title,review_year,age,children_in_home,education,gender,reviewer_type,work_status,genre,release_year,length_minutes,season,total_reviews,rating,review_text,word_count,review_year_0,release_year_0,age_sc,length_minutes_sc,total_reviews_sc,word_count_sc,rating_good
Under the Rainbow,2005,61,0,Completed College,male,Viewer,Retired,Kids,1996,122,Summer,530,2.1,"I can't believe I paid to see this garbage. The story was nonsensical, and I couldn't connect with any of the characters.",24,5,13,0.7703675139721889,0.0865815732027405,-1.5475370461219025,2.699082002041067,0
Beneath the Surface,2018,33,0,Post-Graduate,female,Viewer,Employed,Drama,2011,105,Fall,9202,3.8,A masterpiece of cinema.,4,18,28,-0.7621575582282577,-1.3882548440784035,1.508250861411239,-1.245214362186709,1
Joyful Journeys,2021,41,1,Post-Graduate,female,Critic,Employed,Kids,2005,111,Spring,9030,3.4,A film that hovered in mediocrity without standing out.,9,21,22,-0.3242932518852729,-0.8677243438615293,1.447642521916809,-0.2591402711297649,1
Rise of the Phoenix,2022,73,0,Post-Graduate,female,Critic,Retired,Action/Adventure,2006,126,Winter,6613,2.5,Regretful choice.,2,22,23,1.427163973486666,0.4336019066806568,0.5959544023933308,-1.6396439986094864,0
Requiem for a Dream,2021,18,0,Completed College,female,Viewer,Student,Drama,2008,128,Winter,3517,4.4,I was hooked from the first scene. The suspense and excitement never let up. A must-see thriller!,18,21,25,-1.5831531326213542,0.6071120734196149,-0.4949957085064164,1.5157930927727343,1
Adventures of the Little Ones,2022,68,0,Completed High School,female,Critic,Employed,Kids,1997,124,Summer,8607,2.1,"I expected more, but this movie left me utterly disappointed.",10,22,14,1.1534987820223006,0.2600917399416986,1.2985882916485296,-0.061925452918376,0
Frozen in Time,2011,37,2,Post-Graduate,female,Viewer,Employed,Drama,1984,141,Winter,2736,3.7,A cinematic treasure that left me deeply moved.,8,11,1,-0.5432254050567653,1.734928157222843,-0.7701998546991498,-0.4563550893411536,1
Quest for Glory,2017,65,0,Completed High School,female,Viewer,Employed,Action/Adventure,2009,140,Spring,8533,3.7,What a treat! This movie exceeded all my expectations. A true cinematic marvel.,13,17,26,0.9892996671436812,1.6481730738533638,1.2725126107032514,0.5297190017157903,1
Silly Adventures,2022,46,0,Completed College,male,Viewer,Employed,Comedy,2018,127,Summer,607,3.2,A middle-of-the-road movie that didn't leave a strong impression.,13,22,35,-0.0506280604209074,0.5203569900501359,-1.52040424297614,0.5297190017157903,1
Quest for Imagination,2005,71,0,Completed College,male,Critic,Retired,Kids,2005,122,Summer,3131,1.7,"Terrible. Just terrible. The script was terrible, the acting was terrible, and I couldn't wait for it to be over.",21,5,22,1.31769789690092,0.0865815732027405,-0.6310120983020567,2.1074375474069007,0
Beyond the Stars,2010,47,1,Post-Graduate,male,Viewer,Employed,Sci-Fi,1997,133,Summer,3305,3.2,"A decent movie, but it didn't quite meet my expectations. Some parts were enjoyable.",15,10,14,0.0041049778719656,1.0408874902670102,-0.5696990106739701,0.9241486381385678,1
Quest for Glory,2014,65,0,Post-Graduate,male,Viewer,Employed,Action/Adventure,2009,140,Spring,8533,3.3,"Not the best, but not the worst either.",8,14,26,0.9892996671436812,1.6481730738533638,1.2725126107032514,-0.4563550893411536,1
Crimson Echoes,2013,53,1,Post-Graduate,female,Viewer,Employed,Drama,1995,139,Fall,955,3.6,An emotional rollercoaster that left me in awe. The captivating plot and outstanding acting made this film a true gem. I couldn't stop thinking about it long after the credits rolled.,32,13,12,0.3325032076292042,1.5614179904838847,-1.3977780677199667,4.2768005477321775,1
Raiders of the Unknown,2011,67,0,Completed High School,male,Critic,Retired,Action/Adventure,2018,121,Summer,6957,2.5,A lackluster attempt that left me bored and unenthusiastic.,9,11,35,1.0987657437294276,-0.00017351016673855375,0.7171710813821915,-0.2591402711297649,0
Legends of Winter,2020,50,2,Post-Graduate,female,Viewer,Employed,Drama,2006,108,Fall,2617,3.7,Deserves all the praise.,4,20,23,0.1683040927505849,-1.1279895939699665,-0.8121323686516917,-1.245214362186709,1
Requiem for a Dream,2015,33,2,Post-Graduate,male,Critic,Employed,Drama,2008,128,Winter,3517,3.4,It's neither remarkable nor terrible.,6,15,25,-0.7621575582282577,0.6071120734196149,-0.4949957085064164,-0.8507847257639313,1
Enchanted Playtime,2013,37,0,Post-Graduate,female,Viewer,Student,Kids,2004,131,Spring,1041,3.1,"It's just an average movie, nothing special.",8,13,21,-0.5432254050567653,0.8673773235280522,-1.3674738979727517,-0.4563550893411536,1
Realm of Illusions,2018,67,0,Completed College,male,Viewer,Employed,Drama,2005,112,Summer,1520,2.9,A movie that had its moments but didn't resonate.,10,18,22,1.0987657437294276,-0.7809692604920502,-1.1986867199620994,-0.061925452918376,0
Midnight Shadows,2020,49,0,Post-Graduate,female,Viewer,Employed,Horror,1995,140,Summer,4464,3.2,"It was alright, but I've seen better.",8,20,12,0.1135710544577118,1.6481730738533638,-0.1612974672202211,-0.4563550893411536,1
The Uncharted Journey,2021,47,0,Completed College,female,Critic,Employed,Action/Adventure,2007,112,Fall,3948,1.4,A painful and frustrating viewing experience. Avoid.,7,21,24,0.0041049778719656,-0.7809692604920502,-0.3431224857035123,-0.6535699075525425,0
Silly Adventures,2013,47,0,Post-Graduate,female,Critic,Employed,Comedy,2018,127,Summer,607,2.5,A lackluster effort that failed to engage or entertain.,9,13,35,0.0041049778719656,0.5203569900501359,-1.52040424297614,-0.2591402711297649,0
Chronicles of Destiny,2015,27,1,Completed College,female,Viewer,Employed,Action/Adventure,2000,125,Fall,4695,2.8,"It wasn't remarkable, but it wasn't awful either.",10,15,17,-1.090555787985496,0.3468468233111777,-0.0798990577829338,-0.061925452918376,0
Chronicles of Destiny,2021,31,0,Completed High School,female,Critic,Employed,Action/Adventure,2000,125,Fall,4695,1.7,"Complete letdown, don't bother.",5,21,17,-0.8716236348140038,0.3468468233111777,-0.0798990577829338,-1.04799954397532,0
Fun Under the Sun,2018,18,0,Completed College,male,Viewer,Student,Comedy,2019,123,Summer,7699,4.3,Utterly compelling and artistically captivating.,5,18,36,-1.5831531326213542,0.1733366565722195,0.9786326389686296,-1.04799954397532,1
Legends Unleashed,2014,53,1,Post-Graduate,female,Viewer,Employed,Action/Adventure,2009,127,Summer,4095,2.7,"Complete letdown, don't bother.",5,14,26,0.3325032076292042,0.5203569900501359,-0.291323497879784,-1.04799954397532,0
Wanderlust,2021,26,0,Completed College,male,Viewer,Student,Other,1998,112,Summer,3716,2.9,A narrative that hovered in mediocrity without standing out.,9,21,15,-1.1452888262783694,-0.7809692604920502,-0.4248732692076277,-0.2591402711297649,0
Empire of Shadows,2020,61,0,Completed High School,male,Viewer,Employed,Action/Adventure,2017,108,Summer,9606,3.5,A triumphant celebration of the human spirit.,7,20,34,0.7703675139721889,-1.1279895939699665,1.6506099844097852,-0.6535699075525425,1
Beyond the Horizon,2016,56,1,Post-Graduate,male,Critic,Employed,Action/Adventure,2010,107,Spring,6820,2.4,A movie that failed to live up to its potential. Disappointing.,11,16,27,0.4967023225078235,-1.2147446773394457,0.668895834226744,0.1352893652930127,0
Clash of Titans,2008,34,1,Completed College,male,Critic,Retired,Action/Adventure,2015,118,Summer,3638,2.4,An absolute disaster that failed to hold my attention.,9,8,32,-0.7074245199353846,-0.2604387602751757,-0.4523584464202183,-0.2591402711297649,0
Forgotten Realms,2008,18,0,Completed College,male,Viewer,Student,Drama,2013,129,Summer,3337,3.9,Every frame felt like a work of art. A must-see.,11,8,30,-1.5831531326213542,0.693867156789094,-0.5584230405354714,0.1352893652930127,1
Fun Under the Sun,2014,22,0,Completed High School,female,Viewer,Unemployed,Comedy,2019,123,Summer,7699,3.3,It's neither remarkable nor terrible.,6,14,36,-1.3642209794498616,0.1733366565722195,0.9786326389686296,-0.8507847257639313,1
Amour Forever,2022,37,0,Completed College,male,Critic,Employed,Romance,2004,134,Fall,6251,2.2,Waste of time.,3,22,21,-0.5432254050567653,1.1276425736364897,0.4683949902015644,-1.4424291803980978,0
Whispers in the Dark,2010,33,1,Completed College,female,Critic,Employed,Horror,2020,130,Spring,2052,2.3,"I couldn't wait for this movie to be over. It was painful to watch, and I had no emotional investment in the characters.",24,10,37,-0.7621575582282577,0.7806222401585731,-1.011223716409559,2.699082002041067,0
Magic of Childhood,2019,52,0,Completed College,female,Critic,Employed,Kids,2014,126,Winter,1036,1.9,"I can't believe I wasted my time on this film. The characters were unlikable, and the story was boring.",20,19,31,0.2777701693363311,0.4336019066806568,-1.369235768306892,1.910222729195512,0
Adventures of the Little Ones,2010,19,0,Completed College,male,Viewer,Employed,Kids,1997,124,Summer,8607,2.4,An uninspired mess that left me utterly unimpressed.,8,10,14,-1.528420094328481,0.2600917399416986,1.2985882916485296,-0.4563550893411536,0
Eternal Sunshine,2021,28,1,Completed College,male,Viewer,Employed,Drama,2017,142,Summer,4603,3.9,A total crowd-pleaser.,4,21,34,-1.0358227496926231,1.821683240592322,-0.1123174719311174,-1.245214362186709,1
Eternal Echoes,2015,47,1,Post-Graduate,female,Critic,Employed,Drama,1992,136,Summer,7130,3.3,"Some moments were enjoyable, others were forgettable.",7,15,9,0.0041049778719656,1.3011527403754477,0.77813179494345,-0.6535699075525425,1
Whispers in the Dark,2015,37,0,Post-Graduate,male,Viewer,Unemployed,Horror,2020,130,Spring,2052,2.9,A so-so narrative that left me feeling indifferent.,9,15,37,-0.5432254050567653,0.7806222401585731,-1.011223716409559,-0.2591402711297649,0
Eternal Sunshine,2017,29,0,Post-Graduate,female,Viewer,Employed,Drama,2017,142,Summer,4603,3.6,Riveting from start to finish - a true gem.,8,17,34,-0.98108971139975,1.821683240592322,-0.1123174719311174,-0.4563550893411536,1
Secret of the Ancients,2021,50,1,Post-Graduate,male,Viewer,Employed,Action/Adventure,2020,115,Summer,9029,4.4,Perfectly executed drama.,3,21,37,0.1683040927505849,-0.520704010383613,1.447290147849981,-1.4424291803980978,1
Unseen Horizons,2011,69,0,Post-Graduate,male,Viewer,Unemployed,Drama,2010,127,Summer,7985,3.9,A breathtaking masterpiece that speaks to the heart.,8,11,27,1.2082318203151736,0.5203569900501359,1.0794116220814616,-0.4563550893411536,1
Reflections of Reality,2018,40,1,Post-Graduate,female,Viewer,Employed,Other,2019,132,Summer,2599,3.7,"An absolute joy to watch. The humor is spot-on, and the characters are lovable.",15,18,36,-0.379026290178146,0.9541324068975312,-0.8184751018545973,0.9241486381385678,1
Lost Treasures,2006,69,0,Completed High School,female,Viewer,Employed,Action/Adventure,2009,144,Spring,4040,2.5,"Complete letdown, don't bother.",5,6,26,1.2082318203151736,1.99519340733128,-0.3107040715553286,-1.04799954397532,0
Epic Discovery,2015,18,0,Completed High School,female,Viewer,Employed,Action/Adventure,1994,130,Fall,7677,2.9,A film that didn't leave a lasting mark.,9,15,11,-1.5831531326213542,0.7806222401585731,0.9708804094984118,-0.2591402711297649,0
Mystic Shadows,2019,22,0,Completed High School,female,Critic,Student,Drama,2010,120,Summer,1455,3.2,Meh. It was neither great nor terrible. I had mixed feelings about this one.,14,19,27,-1.3642209794498616,-0.0869285935362176,-1.2215910343059249,0.7269338199271791,1
Realm of Illusions,2019,71,0,Completed High School,male,Viewer,Unemployed,Drama,2005,112,Summer,1520,3.3,An in-between experience that left me with mixed thoughts.,10,19,22,1.31769789690092,-0.7809692604920502,-1.1986867199620994,-0.061925452918376,1
Requiem for a Dream,2018,18,0,Completed High School,female,Viewer,Student,Drama,2008,128,Winter,3517,4.1,Cinematic excellence shines.,3,18,25,-1.5831531326213542,0.6071120734196149,-0.4949957085064164,-1.4424291803980978,1
Echoes of Eternity,2010,80,0,Post-Graduate,female,Viewer,Retired,Drama,1998,126,Summer,7245,4.2,Top-notch entertainment!,3,10,15,1.8102952415367777,0.4336019066806568,0.8186548126286796,-1.4424291803980978,1
Midnight Whispers,2022,56,0,Completed College,female,Critic,Unemployed,Drama,2012,115,Summer,9341,3.7,An instant classic that will be cherished for years.,9,22,29,0.4967023225078235,-0.520704010383613,1.557230856700343,-0.2591402711297649,1
Hilarity Unleashed,2009,18,0,Completed College,female,Viewer,Unemployed,Comedy,2019,121,Fall,7590,3.3,A middle-of-the-road effort that didn't stand out.,11,9,36,-1.5831531326213542,-0.00017351016673855375,0.9402238656843684,0.1352893652930127,1
Eternal Love,2022,74,0,Post-Graduate,female,Viewer,Unemployed,Romance,2014,108,Fall,997,2.8,"I can't say I was thrilled, but it wasn't terrible either. I found it to be just average.",20,22,31,1.4818970117795391,-1.1279895939699665,-1.3829783569131873,1.910222729195512,0
Beyond Boundaries,2009,62,0,Completed High School,female,Viewer,Employed,Other,2018,114,Fall,8184,3.0,"Some moments were enjoyable, others were forgettable.",7,9,35,0.8251005522650621,-0.607459093753092,1.1495340613802505,-0.6535699075525425,1
Eternal Sunshine,2008,57,0,Completed College,male,Viewer,Employed,Drama,2017,142,Summer,4603,4.1,"An absolute masterpiece! The performances, the music, and the visuals are all top-notch.",14,8,34,0.5514353608006966,1.821683240592322,-0.1123174719311174,0.7269338199271791,1
Requiem for a Dream,2009,80,0,Post-Graduate,female,Critic,Retired,Drama,2008,128,Winter,3517,2.5,An uninspired mess that left me wondering why I bothered.,10,9,25,1.8102952415367777,0.6071120734196149,-0.4949957085064164,-0.061925452918376,0
Eternal Echoes,2017,54,1,Completed High School,female,Viewer,Employed,Drama,1992,136,Summer,7130,4.3,A cinematic treasure that leaves you with a warm feeling. It's a must-watch for all ages.,18,17,9,0.3872362459220773,1.3011527403754477,0.77813179494345,1.5157930927727343,1
Cosmic Adventures,2011,42,0,Post-Graduate,male,Viewer,Unemployed,Sci-Fi,2012,119,Fall,8655,3.1,"It's not remarkable, but it's not terrible either.",10,11,29,-0.2695602135923998,-0.1736836769056967,1.3155022468562776,-0.061925452918376,1
Rise of the Phoenix,2022,43,0,Completed High School,female,Critic,Employed,Action/Adventure,2006,126,Winter,6613,2.5,An uninspired and forgettable mess that isn't worth your time.,11,22,23,-0.2148271752995267,0.4336019066806568,0.5959544023933308,0.1352893652930127,0
Beyond the Horizon,2016,71,0,Post-Graduate,female,Viewer,Retired,Action/Adventure,2010,107,Spring,6820,3.2,A film that neither fully engaged nor disconnected me.,9,16,27,1.31769789690092,-1.2147446773394457,0.668895834226744,-0.2591402711297649,1
Whispers in the Dark,2009,70,0,Post-Graduate,female,Viewer,Employed,Horror,2020,130,Spring,2052,2.4,"Terrible. Just terrible. The script was terrible, the acting was terrible, and I regret ever watching it.",17,9,37,1.2629648586080469,0.7806222401585731,-1.011223716409559,1.3185782745613457,0
Broken Promises,2014,63,0,Completed High School,female,Viewer,Employed,Drama,2008,125,Fall,5560,3.2,An in-between experience that lacked a distinctive quality.,9,14,25,0.8798335905579351,0.3468468233111777,0.2249045100233586,-0.2591402711297649,1
Enchanted Expeditions,2019,47,0,Post-Graduate,male,Viewer,Employed,Action/Adventure,2017,109,Summer,1969,2.8,It's hard to form a strong opinion about it.,10,19,34,0.0041049778719656,-1.0412345106004874,-1.04047076395629,-0.061925452918376,0
A Glimpse Through Time,2017,36,1,Post-Graduate,female,Viewer,Employed,Other,1989,111,Fall,8842,2.8,"Some scenes were interesting, others were forgettable.",7,17,6,-0.5979584433496384,-0.8677243438615293,1.3813961973531292,-0.6535699075525425,0
Lost Treasures,2013,27,0,Post-Graduate,male,Viewer,Employed,Action/Adventure,2009,144,Spring,4040,2.9,"Not great, but not terrible. It falls somewhere in between.",10,13,26,-1.090555787985496,1.99519340733128,-0.3107040715553286,-0.061925452918376,0
Wonderland Adventures,2014,54,0,Completed College,female,Viewer,Unemployed,Kids,2012,98,Spring,2160,2.5,"Terrible. Just terrible. The script was terrible, the acting was terrible, and I regret ever watching it.",17,14,29,0.3872362459220773,-1.9955404276647573,-0.973167317192126,1.3185782745613457,0
Rise of the Phoenix,2007,73,0,Completed High School,female,Viewer,Retired,Action/Adventure,2006,126,Winter,6613,2.6,A film that fell short in every aspect. Disheartening.,9,7,23,1.427163973486666,0.4336019066806568,0.5959544023933308,-0.2591402711297649,0
Unbreakable Bonds,2008,23,1,Completed High School,female,Viewer,Unemployed,Romance,2015,121,Spring,6916,3.4,An adequate effort that didn't quite shine.,8,8,32,-1.3094879411569886,-0.00017351016673855375,0.7027237446422401,-0.4563550893411536,1
Stellar Explorers,2004,26,0,Post-Graduate,female,Viewer,Employed,Sci-Fi,2013,98,Fall,8106,3.3,"It had its moments, but overall, it was just okay. I neither loved it nor hated it.",17,4,30,-1.1452888262783694,-1.9955404276647573,1.1220488841676597,1.3185782745613457,1
Guardians of the Ancients,2012,42,3,Post-Graduate,male,Viewer,Employed,Action/Adventure,2014,116,Summer,3224,3.2,A middle-of-the-road movie that didn't leave a strong impression.,13,12,31,-0.2695602135923998,-0.4339489270141339,-0.598241310087045,0.5297190017157903,1
The Last Crusade,2021,18,0,Post-Graduate,female,Viewer,Employed,Action/Adventure,2015,106,Winter,4492,2.2,An uninspired and forgettable endeavor that isn't worth your time.,11,21,32,-1.5831531326213542,-1.3014997607089247,-0.1514309933490348,0.1352893652930127,0
Realm of Illusions,2020,66,0,Post-Graduate,female,Viewer,Employed,Drama,2005,112,Summer,1520,3.3,An adequate watch with its share of strengths and weaknesses.,10,20,22,1.0440327054365544,-0.7809692604920502,-1.1986867199620994,-0.061925452918376,1
Crazy Antics,2013,34,0,Post-Graduate,male,Critic,Employed,Comedy,1992,131,Winter,6745,2.6,A cinematic disaster that I wish I hadn't endured.,10,13,9,-0.7074245199353846,0.8673773235280522,0.6424677792146377,-0.061925452918376,0
Realm of Legends,2021,33,0,Post-Graduate,male,Viewer,Retired,Action/Adventure,1996,116,Summer,7968,3.0,"I wouldn't rush to see it again, but it was okay.",12,21,13,-0.7621575582282577,-0.4339489270141339,1.073421262945384,0.3325041835044015,1
Empire of Shadows,2017,57,0,Post-Graduate,female,Viewer,Student,Action/Adventure,2017,108,Summer,9606,4.0,An absolute delight!,3,17,34,0.5514353608006966,-1.1279895939699665,1.6506099844097852,-1.4424291803980978,1
Secret of the Ancients,2021,33,0,Completed College,female,Critic,Employed,Action/Adventure,2020,115,Summer,9029,3.2,"It's an average film, nothing more, nothing less.",9,21,37,-0.7621575582282577,-0.520704010383613,1.447290147849981,-0.2591402711297649,1
Lost Treasures,2016,63,0,Post-Graduate,male,Viewer,Employed,Action/Adventure,2009,144,Spring,4040,3.0,"I didn't love it, but I didn't hate it either.",12,16,26,0.8798335905579351,1.99519340733128,-0.3107040715553286,0.3325041835044015,1
Adventures of the Little Ones,2014,61,1,Completed College,male,Viewer,Employed,Kids,1997,124,Summer,8607,4.1,A stunning testament to the power of cinema.,8,14,14,0.7703675139721889,0.2600917399416986,1.2985882916485296,-0.4563550893411536,1
Secret of the Ancients,2018,65,0,Post-Graduate,female,Viewer,Student,Action/Adventure,2020,115,Summer,9029,4.2,Incredible performances throughout.,3,18,37,0.9892996671436812,-0.520704010383613,1.447290147849981,-1.4424291803980978,1
Unseen Horizons,2019,63,2,Completed College,female,Viewer,Retired,Drama,2010,127,Summer,7985,4.0,Absolutely stunning film.,3,19,27,0.8798335905579351,0.5203569900501359,1.0794116220814616,-1.4424291803980978,1
Whispers in the Dark,2011,36,3,Post-Graduate,male,Viewer,Employed,Horror,2020,130,Spring,2052,3.1,An average outing that didn't fully connect.,8,11,37,-0.5979584433496384,0.7806222401585731,-1.011223716409559,-0.4563550893411536,1
Galactic Odyssey,2020,27,0,Post-Graduate,female,Viewer,Retired,Sci-Fi,2010,113,Winter,3673,2.7,"One of the worst movies I've ever seen. It was painful to sit through. The plot made no sense, and the acting was atrocious.",25,20,27,-1.090555787985496,-0.6942141771225712,-0.4400253540812353,2.8962968202524557,0
The Last Crusade,2009,35,1,Completed High School,female,Viewer,Employed,Action/Adventure,2015,106,Winter,4492,2.7,A total misfire that left me questioning my movie choices.,10,9,32,-0.6526914816425115,-1.3014997607089247,-0.1514309933490348,-0.061925452918376,0
Reflections of Reality,2010,18,0,Post-Graduate,male,Viewer,Student,Other,2019,132,Summer,2599,3.7,Thoroughly enjoyable experience.,3,10,36,-1.5831531326213542,0.9541324068975312,-0.8184751018545973,-1.4424291803980978,1
Beyond Boundaries,2017,22,0,Completed High School,male,Critic,Student,Other,2018,114,Fall,8184,2.9,It's hard to form a strong opinion about it.,10,17,35,-1.3642209794498616,-0.607459093753092,1.1495340613802505,-0.061925452918376,0
Quest for the Crystal,2021,57,1,Completed College,male,Viewer,Employed,Action/Adventure,1996,109,Summer,3611,3.2,I found it to be just average. Nothing special.,9,21,13,0.5514353608006966,-1.0412345106004874,-0.4618725462245765,-0.2591402711297649,1
Odyssey of Legends,2022,57,1,Completed College,male,Viewer,Employed,Action/Adventure,2011,117,Fall,7179,3.2,"Some moments were enjoyable, others were forgettable.",7,22,28,0.5514353608006966,-0.3471938436446548,0.7953981242180261,-0.6535699075525425,1
Legends Reborn,2021,27,0,Completed College,female,Viewer,Employed,Action/Adventure,2008,116,Fall,5896,2.8,A film that left me feeling indifferent.,7,21,25,-1.090555787985496,-0.4339489270141339,0.3433021964775947,-0.6535699075525425,0
Requiem for a Dream,2019,65,0,Completed College,female,Critic,Employed,Drama,2008,128,Winter,3517,2.3,"Terrible. Just terrible. The script was terrible, the acting was terrible, and I regret ever watching it.",17,19,25,0.9892996671436812,0.6071120734196149,-0.4949957085064164,1.3185782745613457,0
Reflections of Reality,2010,39,0,Completed College,female,Critic,Unemployed,Other,2019,132,Summer,2599,2.3,A film that lacked direction and substance. Avoid at all costs.,11,10,36,-0.4337593284710191,0.9541324068975312,-0.8184751018545973,0.1352893652930127,0
Futuristic Frontiers,2016,62,0,Completed College,female,Viewer,Employed,Sci-Fi,1988,120,Winter,2755,2.5,"This film was a disaster. The script felt like it was written by a five-year-old, and the acting was equally amateurish.",23,16,5,0.8251005522650621,-0.0869285935362176,-0.7635047474294162,2.5018671838296784,0
Eternal Echoes,2021,61,0,Post-Graduate,male,Critic,Employed,Drama,1992,136,Summer,7130,3.5,Touched my heart deeply.,4,21,9,0.7703675139721889,1.3011527403754477,0.77813179494345,-1.245214362186709,1
Sweet Serenade,2019,37,0,Post-Graduate,male,Viewer,Employed,Romance,1996,118,Fall,3730,2.3,A movie that left me uninterested and thoroughly disappointed.,9,19,13,-0.5432254050567653,-0.2604387602751757,-0.4199400322720346,-0.2591402711297649,0
Fun Under the Sun,2018,20,0,Completed College,female,Viewer,Employed,Comedy,2019,123,Summer,7699,4.0,A remarkable achievement that touched my soul.,7,18,36,-1.473687056035608,0.1733366565722195,0.9786326389686296,-0.6535699075525425,1
Broken Promises,2022,51,0,Post-Graduate,female,Critic,Employed,Drama,2008,125,Fall,5560,2.8,An average experience that didn't leave a strong mark.,10,22,25,0.223037131043458,0.3468468233111777,0.2249045100233586,-0.061925452918376,0
The Adventurous Quest,2019,79,0,Completed College,female,Critic,Retired,Action/Adventure,2011,108,Summer,9822,2.8,It's hard to form a strong opinion about it.,10,19,28,1.7555622032439049,-1.1279895939699665,1.7267227828446512,-0.061925452918376,0
Legends of Winter,2016,53,1,Completed High School,female,Viewer,Employed,Drama,2006,108,Fall,2617,2.8,Neither good nor bad. Just average. I wouldn't call it a masterpiece.,13,16,23,0.3325032076292042,-1.1279895939699665,-0.8121323686516917,0.5297190017157903,0
Shattered Reflections,2014,38,1,Post-Graduate,female,Critic,Employed,Drama,2017,125,Spring,2500,2.9,"I expected more, but it didn't disappoint entirely.",9,14,34,-0.4884923667638922,0.3468468233111777,-0.8533601344705775,-0.2591402711297649,0
Realm of Illusions,2013,55,0,Completed College,male,Viewer,Employed,Drama,2005,112,Summer,1520,3.2,"It's a film that falls in between. Not remarkable, not terrible.",12,13,22,0.4419692842149504,-0.7809692604920502,-1.1986867199620994,0.3325041835044015,1
Secret of the Ancients,2022,23,0,Post-Graduate,female,Viewer,Employed,Action/Adventure,2020,115,Summer,9029,3.4,"I wouldn't call it memorable, just a typical movie.",10,22,37,-1.3094879411569886,-0.520704010383613,1.447290147849981,-0.061925452918376,1
Giggles and Grins,2009,51,0,Post-Graduate,female,Viewer,Employed,Comedy,2012,110,Winter,9926,3.5,"This movie was a delightful surprise! The characters were endearing, and the storyline was heartwarming. It's the perfect feel-good film for a summer evening.",26,9,29,0.223037131043458,-0.9544794272310084,1.763369685794772,3.093511638463845,1
Crazy Antics,2020,72,0,Completed College,female,Viewer,Employed,Comedy,1992,131,Winter,6745,3.4,A middle-of-the-road outing that left me with mixed feelings.,12,20,9,1.372430935193793,0.8673773235280522,0.6424677792146377,0.3325041835044015,1
Journey to the Unknown,2021,68,0,Completed High School,male,Viewer,Employed,Action/Adventure,2000,107,Summer,2537,2.6,"I wouldn't recommend this movie to anyone. It was boring, poorly acted, and had a terrible script.",18,21,17,1.1534987820223006,-1.2147446773394457,-0.8403222939979385,1.5157930927727343,0
Legends Unleashed,2012,58,0,Post-Graduate,female,Viewer,Employed,Action/Adventure,2009,127,Summer,4095,2.7,An absolute disaster that failed to hold my attention.,9,12,26,0.6061683990935697,0.5203569900501359,-0.291323497879784,-0.2591402711297649,0
