title,review_year,age,children_in_home,education,gender,reviewer_type,work_status,genre,release_year,length_minutes,season,total_reviews,rating,review_text,word_count
Laughter Therapy,2022,80,0,Post-Graduate,female,Viewer,Retired,Comedy,1996,143,Summer,2829,2.8,A film that didn't leave a lasting impression.,9
Quest for Imagination,2005,71,0,Completed College,male,Critic,Retired,Kids,2005,122,Summer,3131,1.8,"Terrible. Just terrible. The script was terrible, the acting was terrible, and I couldn't wait for it to be over.",21
Reflections of Reality,2017,50,0,Completed College,male,Viewer,Employed,Other,2019,132,Summer,2599,3.6,Incredible storytelling and breathtaking visuals. I couldn't take my eyes off the screen.,14
Rising Stars,2013,67,0,Completed College,male,Critic,Employed,Drama,2000,112,Summer,2889,2.2,An agonizing viewing experience that I wish I hadn't endured.,11
Visions of Valor,2013,35,1,Post-Graduate,male,Viewer,Employed,Action/Adventure,1987,120,Fall,2574,3.1,A decent attempt that fell short of my expectations.,9
Endless Love,2012,56,0,Completed College,male,Critic,Employed,Romance,2016,147,Spring,3185,1.8,A film that failed to capture my attention or interest.,10
Beyond the Horizon,2009,41,1,Completed College,female,Viewer,Employed,Action/Adventure,2010,107,Spring,6820,3.2,"It had its moments, but overall, it was just okay. I neither loved it nor hated it.",17
Hilarity Unleashed,2013,53,1,Completed High School,female,Viewer,Employed,Comedy,2019,121,Fall,7590,3,A watchable film that left me feeling neutral.,8
Midnight Shadows,2020,49,0,Post-Graduate,female,Viewer,Employed,Horror,1995,140,Summer,4464,3.5,An emotional and visually stunning achievement.,6
Quest for Imagination,2017,34,0,Completed High School,female,Viewer,Employed,Kids,2005,122,Summer,3131,3.5,"Wow, what a great film!",5
Echoes of Valor,2012,61,0,Completed College,male,Viewer,Employed,Action/Adventure,2020,114,Winter,5527,3.2,"A movie that falls in the middle, not outstanding.",9
Odyssey of Hope,2022,63,0,Completed High School,male,Critic,Employed,Action/Adventure,2019,111,Summer,9797,2.5,I wouldn't wish this movie on my worst enemy. It was poorly executed in every way possible.,18
The Last Crusade,2022,32,0,Post-Graduate,male,Viewer,Employed,Action/Adventure,2015,106,Winter,4492,3.1,"I was hoping for better, but it was decent enough.",10
Shattered Illusions,2012,35,1,Completed High School,male,Viewer,Employed,Drama,2013,98,Fall,8485,3.6,A true gem of cinema.,5
Dark Descent,2019,54,2,Post-Graduate,female,Viewer,Employed,Horror,2015,111,Spring,2185,2.9,A movie that failed to leave a strong impact.,9
Mystic Shadows,2019,22,0,Completed High School,female,Critic,Student,Drama,2010,120,Summer,1455,3.1,Meh. It was neither great nor terrible. I had mixed feelings about this one.,14
Odyssey of Hope,2014,48,1,Post-Graduate,male,Viewer,Employed,Action/Adventure,2019,111,Summer,9797,3.7,Cinematic excellence shines.,3
Under the Rainbow,2010,34,0,Completed High School,female,Viewer,Employed,Kids,1996,122,Summer,530,3.2,A passable experience that left me feeling neutral.,8
Guardians of Destiny,2022,27,1,Post-Graduate,female,Critic,Employed,Action/Adventure,2004,119,Winter,374,1.6,"I expected more from this movie, but it was a letdown. The story was predictable, and the acting was mediocre.",20
The Hilarious Movie,2020,29,0,Completed High School,female,Viewer,Employed,Comedy,2014,126,Winter,1399,2.7,"One of the worst movies I've ever seen. It was painful to sit through. The plot was nonsensical, and the acting was atrocious.",24
Realm of Illusions,2013,18,0,Completed College,male,Viewer,Student,Drama,2005,112,Summer,1520,4.2,Exceptional storytelling that had me hooked.,6
Reflections of Reality,2022,32,1,Post-Graduate,male,Critic,Employed,Other,2019,132,Summer,2599,2.2,A film that lacked direction and substance. Avoid at all costs.,11
In Search of Truth,2019,40,0,Post-Graduate,female,Viewer,Employed,Other,2007,112,Summer,6040,3.4,A middle-of-the-road movie. It didn't stand out in any way.,14
The Adventurous Quest,2009,62,0,Post-Graduate,female,Viewer,Employed,Action/Adventure,2011,108,Summer,9822,3.4,A passable movie that didn't leave a strong impression.,10
Raiders of the Unknown,2020,24,0,Completed College,male,Viewer,Unemployed,Action/Adventure,2018,121,Summer,6957,4,A work of pure genius.,5
Midnight Shadows,2016,76,0,Post-Graduate,male,Viewer,Retired,Horror,1995,140,Summer,4464,3.4,A movie that didn't quite make a lasting impression.,10
Frozen in Time,2021,57,0,Post-Graduate,female,Critic,Employed,Drama,1984,141,Winter,2736,2.1,A film that failed to capture my attention or interest.,10
A Glimpse Through Time,2000,30,0,Post-Graduate,female,Critic,Employed,Other,1989,111,Fall,8842,1.6,"I had high hopes for this film, but it was a letdown. The characters were one-dimensional, and the story was a mess.",23
Shattered Illusions,2017,80,0,Completed High School,female,Critic,Employed,Drama,2013,98,Fall,8485,1.8,"I found this movie to be utterly disappointing, with a plot that made no sense, and characters I couldn't care less about. Avoid it.",25
Beyond Boundaries,2011,18,0,Completed High School,male,Viewer,Employed,Other,2018,114,Fall,8184,3.6,A testament to the magic of cinema and storytelling.,9
Hilarity Unleashed,2015,70,0,Post-Graduate,female,Critic,Retired,Comedy,2019,121,Fall,7590,1.4,"This movie was a complete disaster. The plot was confusing, the acting was terrible, and it left me feeling unsatisfied.",20
Adventures of the Little Ones,2010,19,0,Completed College,male,Viewer,Employed,Kids,1997,124,Summer,8607,3.7,A true gem that will leave you touched and inspired.,10
The Hilarious Movie,2014,58,0,Post-Graduate,female,Viewer,Employed,Comedy,2014,126,Winter,1399,2.4,"I found this movie to be utterly disappointing, with a plot that made no sense, and characters I couldn't care less about. Avoid it.",25
A Glimpse Through Time,2012,47,1,Completed High School,male,Viewer,Employed,Other,1989,111,Fall,8842,3.3,"I can't say it's great, but it's not awful either.",13
Whispers of Fate,2021,33,1,Completed High School,male,Viewer,Employed,Drama,2009,102,Fall,8887,3.8,"An absolute joy to watch, full of heart and soul.",10
Quest for Glory,2020,27,3,Post-Graduate,male,Viewer,Employed,Action/Adventure,2009,140,Spring,8533,3.8,Instant classic material.,3
Legends of Winter,2020,50,2,Post-Graduate,female,Viewer,Employed,Drama,2006,108,Fall,2617,3.4,"It's neither here nor there, just an average movie.",10
Empire of Shadows,2019,45,1,Completed College,male,Viewer,Employed,Action/Adventure,2017,108,Summer,9606,3.8,A cinematic triumph that left me in awe.,8
Reflections of Reality,2020,56,0,Completed College,female,Viewer,Employed,Other,2019,132,Summer,2599,3.7,Elegantly executed with a compelling narrative.,6
Wanderlust,2010,57,0,Post-Graduate,female,Critic,Employed,Other,1998,112,Summer,3716,1.7,An uninspired mess that left me wondering why it was made.,11
Requiem for a Dream,2013,73,0,Post-Graduate,female,Viewer,Retired,Drama,2008,128,Winter,3517,3.5,Touched my heart deeply.,4
Realm of Legends,2010,76,0,Post-Graduate,female,Viewer,Employed,Action/Adventure,1996,116,Summer,7968,3.3,"There are parts I liked, but overall, it's average.",10
The Last Crusade,2013,24,0,Post-Graduate,female,Viewer,Student,Action/Adventure,2015,106,Winter,4492,3.4,A movie that didn't leave a strong impression.,9
Futuristic Frontiers,2013,77,0,Completed High School,male,Critic,Retired,Sci-Fi,1988,120,Winter,2755,1.5,Terrible film.,2
Whispers of Fate,2004,43,0,Post-Graduate,male,Viewer,Employed,Drama,2009,102,Fall,8887,3.2,"It was alright, but I've seen better.",8
Enchanted Expeditions,2021,54,0,Completed College,female,Viewer,Retired,Action/Adventure,2017,109,Summer,1969,3.3,A lukewarm experience that neither wowed nor disappointed.,8
Eternal Echoes,2012,51,0,Post-Graduate,female,Viewer,Employed,Drama,1992,136,Summer,7130,4,A heartfelt and inspiring journey worth taking.,7
Legends of Winter,2006,47,1,Completed College,male,Critic,Employed,Drama,2006,108,Fall,2617,1.9,A lackluster attempt that left me bored and uninspired.,9
Beneath the Surface,2020,35,1,Completed College,male,Viewer,Employed,Drama,2011,105,Fall,9202,3.9,A journey worth taking.,4
Mystic Shadows,2022,37,0,Post-Graduate,male,Viewer,Unemployed,Drama,2010,120,Summer,1455,3.7,Captivating from start to finish.,5
Visions of Valor,2020,76,0,Post-Graduate,female,Critic,Retired,Action/Adventure,1987,120,Fall,2574,1.5,"I've never been so disappointed by a film. The acting was subpar, and the story was a snooze fest.",20
Joyful Journeys,2019,80,0,Post-Graduate,male,Viewer,Employed,Kids,2005,111,Spring,9030,3.2,"It's an average movie, nothing to rave about.",9
Eerie Echoes,2006,66,0,Post-Graduate,male,Critic,Employed,Horror,2018,112,Fall,9634,1.8,A film that lacked any semblance of quality or coherence.,10
Legends of Winter,2003,65,0,Post-Graduate,female,Viewer,Employed,Drama,2006,108,Fall,2617,2.9,"It had potential, but it didn't fully deliver.",9
Love's Embrace,2018,43,1,Completed High School,male,Viewer,Employed,Romance,1983,112,Winter,9616,3.5,An emotional masterpiece that moved me to tears.,8
Quest for the Crystal,2014,22,0,Post-Graduate,male,Critic,Student,Action/Adventure,1996,109,Summer,3611,2.3,"I expected more, but this movie left me thoroughly disappointed.",10
Legends Unleashed,2009,47,1,Post-Graduate,female,Viewer,Employed,Action/Adventure,2009,127,Summer,4095,3.6,A cinematic marvel that resonates deeply.,6
Beyond the Stars,2010,47,1,Post-Graduate,male,Viewer,Employed,Sci-Fi,1997,133,Summer,3305,3.5,A captivating masterpiece that left me speechless.,7
The Hilarious Movie,2013,48,0,Completed College,male,Critic,Employed,Comedy,2014,126,Winter,1399,1.1,A movie that failed to deliver on its promises. Avoid at all costs.,13
Odyssey of Legends,2014,45,0,Post-Graduate,female,Critic,Employed,Action/Adventure,2011,117,Fall,7179,1.9,A film that left me bewildered and completely unimpressed.,9
Wanderlust,2010,73,0,Completed College,male,Viewer,Retired,Other,1998,112,Summer,3716,3.1,"It didn't leave a lasting impression, but it wasn't painful to watch.",14
Hilarity Unleashed,2021,77,0,Completed High School,female,Viewer,Unemployed,Comedy,2019,121,Fall,7590,2.9,"It's neither here nor there, just an average movie.",10
Legends of Winter,2019,65,0,Post-Graduate,female,Viewer,Employed,Drama,2006,108,Fall,2617,3.1,A decent attempt that fell short of my expectations.,9
Legends Unleashed,2020,30,1,Completed High School,female,Viewer,Employed,Action/Adventure,2009,127,Summer,4095,3.8,A film to remember.,4
Midnight Whispers,2021,48,3,Completed College,male,Viewer,Employed,Drama,2012,115,Summer,9341,4.4,Cinematic excellence shines.,3
Whispers of Fate,2016,75,0,Post-Graduate,male,Viewer,Retired,Drama,2009,102,Fall,8887,3.3,I neither loved it nor hated it. It didn't live up to the hype.,15
The Adventurous Quest,2014,58,0,Post-Graduate,female,Viewer,Employed,Action/Adventure,2011,108,Summer,9822,3.4,A neutral watch that didn't evoke strong emotions.,9
Beyond Boundaries,2022,31,1,Post-Graduate,female,Viewer,Employed,Other,2018,114,Fall,8184,3.6,"A breathtaking masterpiece that left me speechless. The storytelling, visuals, and performances were exceptional.",14
Heartstrings,2011,39,3,Completed High School,male,Viewer,Employed,Romance,1991,123,Summer,5066,3.6,Spellbinding and emotionally resonant.,4
Whispers of Hope,2021,25,0,Post-Graduate,female,Viewer,Employed,Drama,2018,120,Summer,389,3.8,A true masterpiece that shines in every scene.,8
Mystic Whispers,2014,63,0,Completed High School,female,Viewer,Employed,Drama,2010,122,Summer,857,3.7,Outstanding storytelling.,2
Broken Promises,2012,34,1,Post-Graduate,female,Viewer,Employed,Drama,2008,125,Fall,5560,3.8,A testament to the power of cinema to touch hearts.,10
Midnight Shadows,2006,65,0,Post-Graduate,female,Viewer,Employed,Horror,1995,140,Summer,4464,3.4,A movie that fell short of my expectations.,8
The Uncharted Journey,2018,73,0,Completed College,female,Critic,Retired,Action/Adventure,2007,112,Fall,3948,1.6,"I can't believe I wasted money on this. The characters were one-dimensional, and the story was dull.",19
Requiem for a Dream,2016,64,0,Completed High School,male,Viewer,Employed,Drama,2008,128,Winter,3517,3.8,Highly recommended to all.,4
Heartstrings,2018,37,1,Completed College,male,Viewer,Employed,Romance,1991,123,Summer,5066,3.6,"An instant classic, indeed.",4
Beneath the Surface,2021,23,0,Completed College,male,Viewer,Unemployed,Drama,2011,105,Fall,9202,3.9,Every frame felt like a work of art. A must-see.,11
Stolen Memories,2011,29,1,Post-Graduate,male,Critic,Employed,Drama,2003,109,Summer,3004,2.1,A disaster from start to finish. Save yourself the agony.,10
Laughing Waters,2014,47,1,Completed College,male,Viewer,Employed,Comedy,2006,126,Spring,768,2.6,"I can't find a single redeeming quality in this film. The dialogue was cringe-worthy, and the plot was a mess.",22
Sweet Serenade,2019,38,1,Completed College,female,Viewer,Employed,Romance,1996,118,Fall,3730,3.4,A passable cinematic endeavor that didn't stand out.,9
Tales of Tiny Explorers,2018,67,0,Completed College,female,Viewer,Retired,Kids,2002,118,Fall,4368,3.2,A lukewarm experience that neither wowed nor disappointed.,8
Unseen Horizons,2013,45,0,Post-Graduate,female,Viewer,Employed,Drama,2010,127,Summer,7985,4.2,Heartfelt and beautifully realized. An absolute gem.,7
Secret of the Ancients,2010,18,0,Completed College,female,Viewer,Employed,Action/Adventure,2020,115,Summer,9029,3.8,A journey worth taking.,4
Rise of the Phoenix,2022,63,0,Post-Graduate,female,Viewer,Employed,Action/Adventure,2006,126,Winter,6613,3.4,"It wasn't remarkable, but it wasn't awful either.",10
Unbreakable Bonds,2020,80,0,Post-Graduate,female,Viewer,Retired,Romance,2015,121,Spring,6916,3.5,Unforgettable movie moments.,3
Beyond Boundaries,2021,35,1,Completed College,female,Critic,Employed,Other,2018,114,Fall,8184,2.1,A movie that left me uninterested and thoroughly unmoved.,9
Legends Reborn,2020,52,2,Completed College,male,Critic,Retired,Action/Adventure,2008,116,Fall,5896,2.1,An absolute disaster that failed to hold my attention.,9
Odyssey of Legends,2022,40,0,Completed College,female,Viewer,Employed,Action/Adventure,2011,117,Fall,7179,3.6,A true masterpiece!,3
The Last Crusade,2022,22,0,Post-Graduate,male,Viewer,Student,Action/Adventure,2015,106,Winter,4492,3.6,Truly exceptional and worth every moment.,6
The Enigmatic Drama,2016,35,2,Completed College,female,Viewer,Employed,Drama,2018,118,Summer,5690,4.2,Highly recommended to all.,4
Enchanted Darkness,2022,42,1,Completed College,male,Viewer,Employed,Horror,2009,139,Summer,7361,4.1,Movie perfection achieved.,3
Odyssey of Hope,2018,37,1,Post-Graduate,female,Critic,Employed,Action/Adventure,2019,111,Summer,9797,2.5,"I expected more, but this movie left me thoroughly disappointed.",10
Legends Reborn,2021,51,1,Post-Graduate,male,Critic,Retired,Action/Adventure,2008,116,Fall,5896,2,"Terrible. Just terrible. The script was terrible, the acting was terrible, and I regret ever watching it.",17
Eternal Echoes,2007,18,0,Completed College,male,Viewer,Unemployed,Drama,1992,136,Summer,7130,4.3,A tale of courage and triumph that left me breathless.,10
Whimsical Whispers,2022,65,0,Completed High School,female,Viewer,Employed,Comedy,2020,113,Summer,6627,2.9,A movie that failed to leave a strong impact.,9
Endless Love,2017,27,1,Post-Graduate,female,Critic,Employed,Romance,2016,147,Spring,3185,2.4,A total letdown that I wouldn't wish upon anyone.,10
Magic of Childhood,2012,41,1,Completed High School,female,Viewer,Employed,Kids,2014,126,Winter,1036,4.4,A powerful cinematic gem.,4
Enchanted Hearts,2008,54,1,Completed High School,female,Viewer,Employed,Romance,2019,137,Summer,9467,4.1,A cinematic triumph that left me in awe.,8
Mystic Whispers,2012,61,0,Completed High School,male,Viewer,Employed,Drama,2010,122,Summer,857,3.7,Overflowing with heart and genuine emotion.,6
Frozen in Time,2004,18,0,Post-Graduate,female,Viewer,Employed,Drama,1984,141,Winter,2736,3.4,A movie that failed to leave a memorable mark.,9
Wanderlust,2021,26,0,Completed College,male,Viewer,Student,Other,1998,112,Summer,3716,3.9,A cinematic marvel that resonates deeply.,6
Enchanted Hearts,2019,41,0,Post-Graduate,male,Critic,Employed,Romance,2019,137,Summer,9467,2.6,An uninspired and regrettable mess that left me unsatisfied.,9
Love in the Air,2018,19,0,Post-Graduate,female,Viewer,Student,Romance,2018,130,Summer,6969,4.8,An absolute delight! The humor and heart in this movie make it an instant classic. Loved every minute of it.,20
Futuristic Frontiers,2014,49,2,Completed College,male,Critic,Student,Sci-Fi,1988,120,Winter,2755,2.3,An uninspired and regrettable mess that left me unsatisfied.,9
Odyssey of Legends,2014,40,0,Completed College,female,Critic,Employed,Action/Adventure,2011,117,Fall,7179,2.1,Boring and dull.,3
Innocence Lost,2021,80,0,Completed College,female,Viewer,Unemployed,Drama,2011,131,Summer,3260,3.9,A tale of courage and triumph that left me breathless.,10
Forgotten Realms,2011,18,0,Completed High School,male,Viewer,Student,Drama,2013,129,Summer,3337,4.6,Emotional rollercoaster ride.,3
Laughter Therapy,2012,40,0,Completed College,female,Viewer,Employed,Comedy,1996,143,Summer,2829,2.8,An average outing that didn't leave a lasting impact.,10
Guardians of Destiny,2014,20,0,Completed College,male,Viewer,Student,Action/Adventure,2004,119,Winter,374,3.6,Cinematic brilliance!,2
Eternal Sunshine,2021,28,1,Completed College,male,Viewer,Employed,Drama,2017,142,Summer,4603,4.3,A total crowd-pleaser.,4
Sweet Serenade,2014,75,0,Completed College,male,Viewer,Retired,Romance,1996,118,Fall,3730,2.9,A movie that didn't quite capture my full attention.,10
Giggles and Grins,2021,18,0,Post-Graduate,female,Viewer,Unemployed,Comedy,2012,110,Winter,9926,2.8,An okay outing that didn't fully engage me.,9
Beyond the Horizon,2016,71,0,Post-Graduate,female,Viewer,Retired,Action/Adventure,2010,107,Spring,6820,3,A film that neither fully engaged nor disconnected me.,9
Whispers in the Dark,2015,37,0,Post-Graduate,male,Viewer,Unemployed,Horror,2020,130,Spring,2052,3.3,A so-so narrative that left me feeling indifferent.,9
Shattered Reflections,2021,58,0,Completed High School,male,Critic,Student,Drama,2017,125,Spring,2500,2.9,An in-between experience that hovered in mediocrity.,8
Whispers in the Dark,2016,23,1,Completed High School,female,Viewer,Employed,Horror,2020,130,Spring,2052,3.9,A genuine delight that radiates joy and inspiration.,8
Lost Treasures,2016,63,0,Post-Graduate,male,Viewer,Employed,Action/Adventure,2009,144,Spring,4040,3.2,"I didn't love it, but I didn't hate it either.",12
Shadowed Past,2015,67,0,Completed High School,female,Critic,Employed,Drama,2017,103,Summer,4038,2.1,A lackluster effort that fell flat in every conceivable aspect.,10
Reflections of Reality,2010,18,0,Post-Graduate,male,Viewer,Student,Other,2019,132,Summer,2599,4.2,Thoroughly enjoyable experience.,3
Whispers of Hope,2016,65,0,Completed College,female,Viewer,Unemployed,Drama,2018,120,Summer,389,3.7,Every scene was perfect.,4
Giggles and Grins,2020,40,1,Completed High School,female,Viewer,Retired,Comedy,2012,110,Winter,9926,3.1,"I can't say I was thrilled, but it wasn't terrible either. I found it to be just average.",20
Visions of Valor,2019,74,0,Post-Graduate,male,Critic,Retired,Action/Adventure,1987,120,Fall,2574,1.5,"I expected more, but this movie left me thoroughly dissatisfied.",10
Cosmic Adventures,2010,34,1,Completed College,male,Viewer,Employed,Sci-Fi,2012,119,Fall,8655,3.7,A remarkable achievement that touched my heart.,7
Eternal Love,2018,50,0,Post-Graduate,female,Viewer,Employed,Romance,2014,108,Fall,997,2.7,"I've never been so disappointed by a film. The acting was subpar, and the story was a snooze fest.",20
Futuristic Frontiers,2014,32,0,Completed High School,male,Viewer,Employed,Sci-Fi,1988,120,Winter,2755,3.1,"It had its moments, but overall, it was just okay. I neither loved it nor hated it.",17
Futuristic Frontiers,2006,54,1,Completed College,female,Critic,Employed,Sci-Fi,1988,120,Winter,2755,1.6,A film that left me bewildered and utterly uninterested.,9
Legends of Winter,2016,67,0,Post-Graduate,female,Viewer,Employed,Drama,2006,108,Fall,2617,3.1,An okay watch that didn't quite stand out.,9
Galactic Odyssey,2017,59,0,Post-Graduate,male,Viewer,Employed,Sci-Fi,2010,113,Winter,3673,2.9,A film that lacked the impact I was hoping for.,10
Enchanted Darkness,2017,24,0,Completed College,female,Viewer,Unemployed,Horror,2009,139,Summer,7361,4.4,An extraordinary journey that left me inspired.,7
Quest for the Crystal,2022,69,1,Completed College,female,Viewer,Employed,Action/Adventure,1996,109,Summer,3611,3.4,"It was alright, but I've seen better.",8
Amour Forever,2006,35,1,Completed High School,female,Viewer,Employed,Romance,2004,134,Fall,6251,3.6,An emotional rollercoaster that pulled at my heartstrings.,8
Secret of the Ancients,2021,50,1,Post-Graduate,male,Viewer,Employed,Action/Adventure,2020,115,Summer,9029,4,Perfectly executed drama.,3
Rising Stars,2016,71,0,Post-Graduate,male,Viewer,Retired,Drama,2000,112,Summer,2889,3.4,A passable movie that didn't leave a strong impression.,10
Soulbound,2021,52,0,Completed College,female,Critic,Employed,Drama,2010,131,Fall,1618,2.3,A movie that left me uninterested and thoroughly disappointed.,9
Requiem for a Dream,2020,36,1,Completed College,female,Critic,Employed,Drama,2008,128,Winter,3517,2.5,A film that left me baffled and questioning its purpose.,10
Rolling on the Floor,2021,54,1,Post-Graduate,male,Viewer,Employed,Comedy,2015,129,Summer,410,2.8,A narrative that fell somewhere in the middle for me.,10
Echoes of Valor,2014,36,1,Post-Graduate,female,Critic,Employed,Action/Adventure,2020,114,Winter,5527,1.9,A movie that left me utterly uninterested and unengaged.,9
The Mysterious Expedition,2021,40,1,Post-Graduate,female,Critic,Employed,Action/Adventure,2016,145,Fall,5056,2.2,I don't know what the filmmakers were thinking. This movie was a disaster from start to finish.,18
Echoes of Eternity,2020,80,0,Completed College,male,Critic,Retired,Drama,1998,126,Summer,7245,2.6,"Terrible acting, wasted my time.",5
Adventures of the Little Ones,2022,68,0,Completed High School,female,Critic,Employed,Kids,1997,124,Summer,8607,2.3,"I expected more, but this movie left me utterly disappointed.",10
Shadowed Past,2020,49,1,Post-Graduate,female,Viewer,Employed,Drama,2017,103,Summer,4038,3.6,Pure cinematic magic that will stay with you forever.,9
The Hilarious Movie,2013,18,0,Post-Graduate,male,Viewer,Employed,Comedy,2014,126,Winter,1399,2.4,A film that left me baffled and questioning its purpose.,10
Empire of Shadows,2022,80,0,Post-Graduate,female,Critic,Retired,Action/Adventure,2017,108,Summer,9606,2.1,A painful viewing experience that I won't soon forget.,10
Shadowed Past,2013,63,0,Completed High School,male,Viewer,Employed,Drama,2017,103,Summer,4038,3.5,A true work of art that captures the essence of life.,11
Enchanted Playtime,2015,18,0,Post-Graduate,male,Viewer,Student,Kids,2004,131,Spring,1041,3.7,A remarkable achievement that touched my soul.,7
A Glimpse Through Time,2018,63,1,Completed College,female,Viewer,Employed,Other,1989,111,Fall,8842,3.3,A movie that hovered in the middle ground for me.,10
The Mysterious Expedition,2019,60,0,Completed College,male,Critic,Employed,Action/Adventure,2016,145,Fall,5056,2.1,A film that lacked any semblance of quality or coherence.,10
Soulbound,2020,58,0,Completed High School,male,Viewer,Student,Drama,2010,131,Fall,1618,4.3,What a treat! This movie exceeded all my expectations. A true cinematic marvel.,13
Silly Adventures,2012,57,0,Completed High School,female,Viewer,Employed,Comedy,2018,127,Summer,607,2.6,A disappointment from start to finish. Don't waste your time.,11
Mystic Whispers,2020,57,0,Post-Graduate,male,Viewer,Employed,Drama,2010,122,Summer,857,3.6,A total crowd-pleaser.,4
Sweet Serenade,2020,55,2,Completed College,male,Viewer,Employed,Romance,1996,118,Fall,3730,3.2,A lukewarm experience that neither wowed nor disappointed.,8
Chronicles of Destiny,2014,65,0,Completed College,female,Viewer,Employed,Action/Adventure,2000,125,Fall,4695,3.3,An average experience that didn't leave a strong mark.,10
Realm of Legends,2017,33,1,Completed College,female,Viewer,Employed,Action/Adventure,1996,116,Summer,7968,3.7,A true work of art that captures the essence of life.,11
Legends Reborn,2015,49,1,Completed College,female,Critic,Employed,Action/Adventure,2008,116,Fall,5896,2.1,A complete letdown that left me frustrated and annoyed.,9
Sweet Serenade,2018,48,3,Post-Graduate,female,Critic,Employed,Romance,1996,118,Fall,3730,1.7,"I expected more from this movie, but it was a letdown. The story was predictable, and the acting was mediocre.",20
Futuristic Frontiers,2014,47,3,Post-Graduate,male,Viewer,Employed,Sci-Fi,1988,120,Winter,2755,3.1,A film that left me feeling indifferent.,7
Silly Adventures,2015,27,2,Post-Graduate,male,Critic,Employed,Comedy,2018,127,Summer,607,1.6,A film that fell short of every expectation. Disappointing.,9
Echoes of Valor,2017,50,0,Completed High School,female,Viewer,Unemployed,Action/Adventure,2020,114,Winter,5527,3.2,A neutral journey that left me with mixed feelings.,9
Guardians of Destiny,2019,41,1,Completed College,male,Viewer,Employed,Action/Adventure,2004,119,Winter,374,3.1,A film that didn't fully engage me but had its moments.,12
Clash of Titans,2013,58,0,Completed High School,male,Viewer,Employed,Action/Adventure,2015,118,Summer,3638,3.4,A movie that didn't quite live up to the hype.,11
Beyond Boundaries,2010,48,1,Completed High School,female,Critic,Employed,Other,2018,114,Fall,8184,2.2,A movie that failed to live up to its potential. Disappointing.,11
Whimsical Whispers,2014,31,1,Post-Graduate,female,Viewer,Employed,Comedy,2020,113,Summer,6627,3.1,A neutral watch that neither impressed nor disappointed.,8
