title,review_year,age,children_in_home,education,gender,reviewer_type,work_status,genre,release_year,length_minutes,season,total_reviews,rating,review_text,word_count
Visions of Valor,2019,27,2,Post-Graduate,female,Viewer,Employed,Action/Adventure,1987,120,Fall,2574,3.2,"A middle-of-the-road movie, nothing exceptional.",8
Hilarity Unleashed,2014,43,1,Completed College,female,Viewer,Employed,Comedy,2019,121,Fall,7590,3.2,"It didn't wow me, but it didn't disappoint either.",11
Soulbound,2019,65,0,Post-Graduate,male,Viewer,Employed,Drama,2010,131,Fall,1618,3.6,An emotional rollercoaster that left me in awe. The captivating plot and outstanding acting made this film a true gem. I couldn't stop thinking about it long after the credits rolled.,32
Amour Forever,2011,43,1,Post-Graduate,female,Critic,Employed,Romance,2004,134,Fall,6251,2.1,A movie that failed to live up to its potential. Disappointing.,11
In Search of Truth,2003,54,1,Completed College,female,Critic,Employed,Other,2007,112,Summer,6040,2,A movie that left me uninterested and thoroughly unmoved.,9
Eternal Echoes,2017,80,0,Completed College,female,Viewer,Retired,Drama,1992,136,Summer,7130,4.1,Lives up to its name. It's an enchanting story that explores the depths of human nature. The performances were exceptional.,21
Visions of Valor,2022,80,0,Completed College,female,Critic,Retired,Action/Adventure,1987,120,Fall,2574,1.6,"This movie was a complete mess. The editing was choppy, and the plot was all over the place.",18
Legends Unleashed,2021,73,0,Completed College,female,Critic,Retired,Action/Adventure,2009,127,Summer,4095,2.2,An agonizing viewing experience that I won't soon forget.,10
Requiem for a Dream,2009,80,0,Post-Graduate,female,Critic,Retired,Drama,2008,128,Winter,3517,2,An uninspired mess that left me wondering why I bothered.,10
Enchanted Hearts,2013,28,1,Post-Graduate,male,Viewer,Employed,Romance,2019,137,Summer,9467,4.5,A journey worth taking.,4
In Search of Truth,2009,40,0,Completed High School,female,Critic,Employed,Other,2007,112,Summer,6040,2.1,"I expected more, but this movie left me thoroughly dissatisfied.",10
Beyond the Stars,2008,80,0,Post-Graduate,female,Critic,Retired,Sci-Fi,1997,133,Summer,3305,1.8,A lackluster attempt that left me bored and unenthused.,9
Empire of Shadows,2017,62,0,Completed College,female,Viewer,Unemployed,Action/Adventure,2017,108,Summer,9606,3.6,A true cinematic gem.,4
Whispers of Hope,2022,63,0,Completed College,male,Critic,Employed,Drama,2018,120,Summer,389,2.4,"I had high hopes for this movie, but it let me down in every way. The plot was confusing, and the acting was terrible.",24
Mystic Shadows,2013,70,0,Post-Graduate,female,Viewer,Retired,Drama,2010,120,Summer,1455,3.4,"It didn't wow me, but it was watchable. A so-so film with some redeeming qualities.",17
Eternal Sunshine,2020,59,0,Post-Graduate,male,Viewer,Employed,Drama,2017,142,Summer,4603,4.1,Incredible! I was glued to the screen from start to finish. The acting and direction are top-notch.,18
The Adventurous Quest,2019,79,0,Completed College,female,Critic,Retired,Action/Adventure,2011,108,Summer,9822,2.2,"I couldn't wait for this movie to end. It was painful to watch, and I couldn't care less about the characters.",23
Beyond the Stars,2018,31,2,Completed College,female,Viewer,Employed,Sci-Fi,1997,133,Summer,3305,3.8,An instant classic that will be cherished for years.,9
Shattered Illusions,2019,37,1,Post-Graduate,male,Critic,Unemployed,Drama,2013,98,Fall,8485,2.1,Predictable and utterly unimpressive.,4
Echoes of Valor,2022,35,0,Completed College,female,Viewer,Employed,Action/Adventure,2020,114,Winter,5527,3.4,"It wasn't remarkable, but it wasn't awful either.",10
Eerie Echoes,2016,34,1,Completed College,male,Viewer,Employed,Horror,2018,112,Fall,9634,3.8,An unforgettable experience! The deep emotional connections and the exploration of human nature in this movie were thought-provoking. I highly recommend it.,23
Innocence Lost,2012,41,0,Post-Graduate,female,Viewer,Employed,Drama,2011,131,Summer,3260,3.9,A cinematic triumph!,3
Joyful Journeys,2017,78,0,Completed High School,female,Viewer,Retired,Kids,2005,111,Spring,9030,3.1,A film that didn't leave a lasting mark.,9
The Last Crusade,2020,27,1,Post-Graduate,female,Viewer,Employed,Action/Adventure,2015,106,Winter,4492,3.2,A film that didn't leave a lasting mark.,9
Midnight Shadows,2018,54,1,Post-Graduate,female,Viewer,Employed,Horror,1995,140,Summer,4464,3.7,Every frame felt like a work of art. A must-see.,11
Eternal Sunshine,2009,80,0,Post-Graduate,female,Viewer,Retired,Drama,2017,142,Summer,4603,3.8,A tale of courage and triumph that left me breathless.,10
The Hilarious Movie,2008,18,0,Post-Graduate,female,Critic,Student,Comedy,2014,126,Winter,1399,2.5,A movie that left me uninterested and thoroughly disappointed.,9
Beyond Boundaries,2017,63,0,Post-Graduate,male,Viewer,Employed,Other,2018,114,Fall,8184,3.4,A film that had its moments but didn't fully resonate.,11
Lost Treasures,2012,25,1,Completed College,male,Viewer,Student,Action/Adventure,2009,144,Spring,4040,4.2,A remarkable achievement that touched my soul.,7
Requiem for a Dream,2012,74,0,Post-Graduate,female,Viewer,Retired,Drama,2008,128,Winter,3517,3.4,"I expected more, but it fell short.",7
Legends of Winter,2010,61,0,Post-Graduate,male,Viewer,Employed,Drama,2006,108,Fall,2617,2.9,"It's an average film, nothing more, nothing less.",9
Raiders of the Unknown,2007,52,0,Completed High School,male,Critic,Employed,Action/Adventure,2018,121,Summer,6957,2.3,"Not worth your money, disappointing.",5
Fading Memories,2018,43,0,Post-Graduate,female,Viewer,Employed,Drama,2001,133,Winter,1885,3.6,Powerful and poignant. A truly remarkable achievement.,7
Beneath the Surface,2015,18,0,Completed College,female,Viewer,Employed,Drama,2011,105,Fall,9202,3.8,A heartfelt triumph that resonated with my soul.,8
The Hilarious Movie,2020,27,1,Completed College,male,Viewer,Employed,Comedy,2014,126,Winter,1399,2.9,A film that was neither remarkable nor forgettable.,8
Echoes of Eternity,2010,28,1,Completed High School,female,Viewer,Employed,Drama,1998,126,Summer,7245,4.2,Outstanding performances throughout.,3
Echoes of Valor,2007,70,0,Completed College,female,Viewer,Retired,Action/Adventure,2020,114,Winter,5527,3.1,I neither loved it nor hated it. It didn't live up to the hype.,15
Endless Love,2016,41,0,Post-Graduate,male,Viewer,Employed,Romance,2016,147,Spring,3185,3.3,"Some parts were good, others were mediocre.",7
Galactic Odyssey,2014,42,1,Post-Graduate,female,Critic,Employed,Sci-Fi,2010,113,Winter,3673,1.7,A film that was as dull as it was disappointing.,10
Eternal Echoes,2022,31,1,Post-Graduate,male,Viewer,Employed,Drama,1992,136,Summer,7130,4.4,An emotional tour de force that left me moved.,9
Midnight Shadows,2020,45,0,Post-Graduate,female,Critic,Employed,Horror,1995,140,Summer,4464,2.2,A film that left me bewildered and utterly uninterested.,9
Love in the Air,2017,18,0,Completed High School,female,Viewer,Employed,Romance,2018,130,Summer,6969,4.5,A heartfelt and beautifully crafted cinematic journey.,7
Midnight Whispers,2017,64,0,Completed College,female,Viewer,Employed,Drama,2012,115,Summer,9341,4.2,A symphony of emotions that left me deeply touched.,9
Reflections of Reality,2012,60,0,Post-Graduate,male,Viewer,Employed,Other,2019,132,Summer,2599,3.4,"I was hoping for better, but it was decent enough.",10
Journey to the Unknown,2020,73,0,Completed College,female,Viewer,Retired,Action/Adventure,2000,107,Summer,2537,3.1,A passable movie that didn't leave a strong impression.,10
Wanderlust,2014,41,1,Post-Graduate,female,Critic,Employed,Other,1998,112,Summer,3716,1.8,"I was excited to see this film, but it turned out to be a mess. The plot was incoherent, and the characters were forgettable.",24
Futuristic Frontiers,2016,62,0,Completed College,female,Viewer,Employed,Sci-Fi,1988,120,Winter,2755,3.1,A movie that fell short of my expectations.,8
Stellar Explorers,2018,21,0,Post-Graduate,female,Viewer,Employed,Sci-Fi,2013,98,Fall,8106,3,"I'm neutral about this one, neither good nor bad.",10
Visions of Valor,2010,60,0,Post-Graduate,male,Viewer,Employed,Action/Adventure,1987,120,Fall,2574,2.9,A mixed bag of emotions and storytelling.,7
Mystic Shadows,2021,51,1,Completed High School,female,Critic,Employed,Drama,2010,120,Summer,1455,2.7,A misfire that lacked direction and substance. Avoid.,8
Crimson Echoes,2019,67,0,Completed College,male,Critic,Employed,Drama,1995,139,Fall,955,2.1,A movie that left me utterly uninterested and unengaged.,9
Crimson Echoes,2013,65,0,Post-Graduate,female,Critic,Employed,Drama,1995,139,Fall,955,2,I don't know how this movie got made. It was a complete disaster from start to finish.,18
Lost in Time,2016,23,0,Completed College,male,Viewer,Employed,Drama,2019,119,Summer,8311,4.3,A breathtaking masterpiece that speaks to the heart.,8
Eternal Sunshine,2021,55,0,Completed High School,male,Critic,Employed,Drama,2017,142,Summer,4603,2.9,An average journey that didn't fully engage me.,9
Forgotten Realms,2014,80,0,Post-Graduate,male,Viewer,Employed,Drama,2013,129,Summer,3337,3.8,A film to remember.,4
Lost in Time,2021,34,1,Post-Graduate,male,Critic,Employed,Drama,2019,119,Summer,8311,2.9,A film that didn't fully resonate with me.,9
The Hilarious Movie,2020,60,0,Completed College,female,Viewer,Employed,Comedy,2014,126,Winter,1399,2.7,This film was a disaster from start to finish. I can't believe I wasted two hours of my life on this garbage.,23
Frozen in Time,2013,48,1,Post-Graduate,male,Viewer,Employed,Drama,1984,141,Winter,2736,3.6,A cinematic triumph!,3
Rise of the Phoenix,2022,43,0,Completed High School,female,Critic,Employed,Action/Adventure,2006,126,Winter,6613,2.3,An uninspired and forgettable mess that isn't worth your time.,11
Innocence Lost,2021,59,0,Post-Graduate,female,Viewer,Employed,Drama,2011,131,Summer,3260,4,A cinematic triumph that left me in awe.,8
Secret of the Ancients,2018,65,0,Post-Graduate,female,Viewer,Student,Action/Adventure,2020,115,Summer,9029,4.3,Incredible performances throughout.,3
Visions of Valor,2015,35,0,Completed College,male,Viewer,Employed,Action/Adventure,1987,120,Fall,2574,3.1,"It's a film that falls in between. Not remarkable, not terrible.",12
In Search of Truth,2021,50,1,Post-Graduate,male,Critic,Employed,Other,2007,112,Summer,6040,2.2,A lackluster effort that fell flat in every conceivable way.,10
Sweet Serenade,2017,60,0,Post-Graduate,male,Viewer,Employed,Romance,1996,118,Fall,3730,3.1,A neutral watch that didn't evoke strong emotions.,9
Shattered Reflections,2011,20,0,Post-Graduate,female,Viewer,Employed,Drama,2017,125,Spring,2500,3.6,A captivating journey.,3
Eternal Love,2022,74,0,Post-Graduate,female,Viewer,Unemployed,Romance,2014,108,Fall,997,2.8,"I can't say I was thrilled, but it wasn't terrible either. I found it to be just average.",20
Joyful Journeys,2017,27,0,Post-Graduate,female,Viewer,Employed,Kids,2005,111,Spring,9030,3.3,"I can't say I was thrilled, but it wasn't terrible either.",13
Broken Promises,2009,80,0,Post-Graduate,male,Viewer,Retired,Drama,2008,125,Fall,5560,3.4,A middle-of-the-road effort that didn't stand out.,11
Guardians of Destiny,2018,47,1,Completed High School,female,Critic,Employed,Action/Adventure,2004,119,Winter,374,1.8,A film that left me bewildered and completely unsatisfied.,9
Dark Descent,2020,33,3,Completed College,male,Viewer,Employed,Horror,2015,111,Spring,2185,3.2,"I wouldn't rush to see it again, but it was okay.",12
Edge of Eternity,2022,74,0,Post-Graduate,female,Viewer,Employed,Drama,2018,104,Winter,4137,3.1,"Not the best, but not the worst either.",8
Midnight Shadows,2009,47,1,Completed High School,male,Viewer,Employed,Horror,1995,140,Summer,4464,3.7,What a treat! This movie exceeded all my expectations. A true cinematic marvel.,13
Love in the Air,2021,79,0,Post-Graduate,female,Viewer,Retired,Romance,2018,130,Summer,6969,3.8,This film is a gem. It's a rollercoaster of emotions that I didn't want to end. Highly recommended!,20
Midnight Shadows,2019,37,0,Completed High School,male,Critic,Unemployed,Horror,1995,140,Summer,4464,2.4,An agonizing viewing experience that I won't soon forget.,10
Lost in Time,2014,35,0,Completed College,female,Viewer,Employed,Drama,2019,119,Summer,8311,4.2,Absolutely outstanding!,2
Tales of Tiny Explorers,2020,41,0,Post-Graduate,female,Critic,Employed,Kids,2002,118,Fall,4368,1.7,A lackluster effort that fell flat in every conceivable aspect.,10
Requiem for a Dream,2018,18,0,Completed High School,female,Viewer,Student,Drama,2008,128,Winter,3517,4.5,Cinematic excellence shines.,3
Eternal Echoes,2017,54,1,Completed High School,female,Viewer,Employed,Drama,1992,136,Summer,7130,4.3,A cinematic treasure that leaves you with a warm feeling. It's a must-watch for all ages.,18
Love in the Air,2020,41,0,Completed College,male,Viewer,Employed,Romance,2018,130,Summer,6969,3.9,A visual and emotional masterpiece that left me speechless.,9
Legends Reborn,2019,18,0,Completed High School,female,Critic,Student,Action/Adventure,2008,116,Fall,5896,2.7,A disappointment from start to finish. Don't waste your time.,11
Rise of the Phoenix,2022,56,0,Post-Graduate,female,Viewer,Employed,Action/Adventure,2006,126,Winter,6613,3.5,An emotional masterpiece that moved me to tears.,8
Forgotten Realms,2019,48,0,Post-Graduate,female,Critic,Employed,Drama,2013,129,Summer,3337,2.5,A total disappointment that I deeply regret watching.,8
In Search of Truth,2004,49,0,Post-Graduate,male,Viewer,Retired,Other,2007,112,Summer,6040,3.1,A middle-of-the-road movie. It didn't stand out in any way.,14
Odyssey of Hope,2021,43,1,Completed High School,female,Viewer,Employed,Action/Adventure,2019,111,Summer,9797,4,Every frame felt like a work of art. A must-see.,11
In Search of Truth,2009,40,0,Completed College,female,Viewer,Employed,Other,2007,112,Summer,6040,3.5,"Wow, what a great film!",5
Lost Treasures,2021,30,0,Completed High School,female,Viewer,Employed,Action/Adventure,2009,144,Spring,4040,3.6,Laughing Waters is a cinematic masterpiece. The cinematography and storytelling were impeccable. This film is a true work of art.,20
Eternal Echoes,2021,61,0,Post-Graduate,male,Critic,Employed,Drama,1992,136,Summer,7130,2.7,"I can't believe I wasted my time on this film. The characters were unlikable, and the story was boring.",20
Whispers in the Dark,2013,60,0,Post-Graduate,male,Critic,Employed,Horror,2020,130,Spring,2052,1.7,"I expected so much more from this film, but it fell flat. Boring and uninspired, it left me with a sense of wasted potential.",24
Realm of Illusions,2020,66,0,Post-Graduate,female,Viewer,Employed,Drama,2005,112,Summer,1520,3.5,An unforgettable experience.,3
Guardians of the Ancients,2020,24,1,Completed High School,male,Viewer,Employed,Action/Adventure,2014,116,Summer,3224,3.7,Powerful and poignant. A truly remarkable achievement.,7
Chronicles of Courage,2016,25,1,Post-Graduate,female,Critic,Student,Action/Adventure,1995,132,Summer,1983,2.6,A complete letdown that I wouldn't wish upon anyone.,10
Wonderland Adventures,2022,61,0,Post-Graduate,female,Critic,Employed,Kids,2012,98,Spring,2160,1.2,Not worth watching.,3
Quest for Glory,2017,65,0,Completed High School,female,Viewer,Employed,Action/Adventure,2009,140,Spring,8533,3.7,What a treat! This movie exceeded all my expectations. A true cinematic marvel.,13
Enchanted Playtime,2019,36,0,Completed College,female,Critic,Retired,Kids,2004,131,Spring,1041,1.9,A movie that failed to deliver on its promises. Disappointing.,10
Whimsical Whispers,2009,27,1,Post-Graduate,female,Viewer,Employed,Comedy,2020,113,Summer,6627,3,An average journey that didn't evoke strong reactions.,9
Shattered Reflections,2020,51,1,Post-Graduate,male,Viewer,Employed,Drama,2017,125,Spring,2500,3.7,Engaging and heartfelt.,3
Quest for Imagination,2017,20,0,Post-Graduate,female,Critic,Employed,Kids,2005,122,Summer,3131,2,An absolute disaster that failed to hold my attention.,9
Sweet Serenade,2022,55,0,Post-Graduate,male,Viewer,Employed,Romance,1996,118,Fall,3730,3,An average journey that didn't evoke strong reactions.,9
Under the Rainbow,2016,79,0,Post-Graduate,male,Viewer,Unemployed,Kids,1996,122,Summer,530,3,An average outing that left me with mixed feelings.,9
Raiders of the Unknown,2018,18,0,Completed High School,female,Viewer,Student,Action/Adventure,2018,121,Summer,6957,4.4,A phenomenal performance.,3
The Hilarious Movie,2022,32,1,Post-Graduate,female,Viewer,Employed,Comedy,2014,126,Winter,1399,2.7,A movie that failed to deliver on its promises. Disappointing.,10
Love's Embrace,2016,59,0,Completed High School,female,Viewer,Employed,Romance,1983,112,Winter,9616,3.2,It's hard to form a strong opinion about it.,10
Shattered Reflections,2018,75,0,Completed College,female,Critic,Employed,Drama,2017,125,Spring,2500,2.2,A movie that failed to live up to its potential. Disappointing.,11
Legends Reborn,2015,41,1,Post-Graduate,male,Viewer,Employed,Action/Adventure,2008,116,Fall,5896,3.4,"I wasn't blown away, but it was decent.",9
Odyssey of Legends,2022,47,0,Completed High School,female,Critic,Employed,Action/Adventure,2011,117,Fall,7179,2,"Regret watching this, waste of time.",6
The Enigmatic Drama,2014,52,1,Post-Graduate,male,Critic,Employed,Drama,2018,118,Summer,5690,2.6,A movie that failed to deliver on its promises. Disappointing.,10
Realm of Illusions,2019,70,0,Post-Graduate,male,Critic,Retired,Drama,2005,112,Summer,1520,2,A painful viewing experience that I won't soon forget.,10
Adventures of the Little Ones,2021,63,0,Completed College,female,Viewer,Employed,Kids,1997,124,Summer,8607,3.8,Instant classic material.,3
Innocence Lost,2020,39,0,Post-Graduate,male,Viewer,Employed,Drama,2011,131,Summer,3260,4,Utterly compelling and artistically captivating.,5
Sweet Serenade,2019,37,0,Post-Graduate,male,Viewer,Employed,Romance,1996,118,Fall,3730,3.1,"It falls in the middle, not the best nor the worst.",11
Legends Reborn,2014,50,1,Completed High School,female,Viewer,Employed,Action/Adventure,2008,116,Fall,5896,3.4,A film with potential that didn't quite soar.,9
Edge of Eternity,2021,29,1,Post-Graduate,female,Viewer,Employed,Drama,2018,104,Winter,4137,3.5,Cinematic excellence shines.,3
Cosmic Adventures,2018,18,0,Completed College,female,Critic,Employed,Sci-Fi,2012,119,Fall,8655,2.3,A disappointment from start to finish. Don't waste your time.,11
Raiders of the Unknown,2020,35,1,Completed College,male,Viewer,Unemployed,Action/Adventure,2018,121,Summer,6957,4.1,A captivating journey.,3
Lost Treasures,2019,50,0,Post-Graduate,female,Viewer,Employed,Action/Adventure,2009,144,Spring,4040,3.3,"I can't say it's great, but it's not awful either.",13
Lost Treasures,2021,48,0,Post-Graduate,female,Viewer,Employed,Action/Adventure,2009,144,Spring,4040,3.3,An okay narrative that lacked a distinct identity.,8
Beyond Boundaries,2019,43,1,Completed High School,female,Viewer,Employed,Other,2018,114,Fall,8184,3.7,A heartfelt and beautifully crafted cinematic journey.,7
Odyssey of Hope,2021,18,1,Post-Graduate,female,Critic,Employed,Action/Adventure,2019,111,Summer,9797,2.5,A cinematic disaster that I wish I hadn't endured.,10
Shattered Reflections,2017,47,1,Completed College,male,Viewer,Employed,Drama,2017,125,Spring,2500,3.9,Movie perfection achieved.,3
Soulbound,2013,50,1,Post-Graduate,male,Critic,Employed,Drama,2010,131,Fall,1618,2.1,Hated it.,2
Laughter Therapy,2022,80,0,Completed College,female,Viewer,Retired,Comedy,1996,143,Summer,2829,2.8,A film that left me feeling indifferent.,7
Quest for Glory,2018,18,1,Post-Graduate,male,Viewer,Employed,Action/Adventure,2009,140,Spring,8533,3.8,Loved every minute of it.,5
Quest for Imagination,2010,25,0,Post-Graduate,female,Viewer,Employed,Kids,2005,122,Summer,3131,3.4,"I wouldn't rush to see it again, but it was okay.",12
Mystic Whispers,2018,52,0,Completed College,female,Critic,Unemployed,Drama,2010,122,Summer,857,2.4,"I couldn't wait for this movie to be over. It was painful to watch, and I had no emotional investment in the characters.",24
Crimson Echoes,2017,20,0,Post-Graduate,male,Viewer,Employed,Drama,1995,139,Fall,955,3.6,"A true gem in the world of cinema. The characters are relatable, and the story is unforgettable.",17
Legends Unleashed,2006,80,0,Post-Graduate,female,Critic,Retired,Action/Adventure,2009,127,Summer,4095,1.9,A forgettable experience that fell flat in every aspect.,9
Raiders of the Unknown,2012,70,0,Completed High School,female,Critic,Retired,Action/Adventure,2018,121,Summer,6957,2.2,This movie was so bad it's almost impressive. I can't think of a single redeeming quality.,18
Crazy Antics,2017,53,3,Completed College,male,Critic,Employed,Comedy,1992,131,Winter,6745,1.6,"I can't believe I wasted my time on this garbage. The story made no sense, and I couldn't care less about the characters.",25
Empire of Shadows,2003,31,1,Completed College,female,Viewer,Employed,Action/Adventure,2017,108,Summer,9606,3.6,An emotional rollercoaster that pulled at my heartstrings.,8
Enchanted Playtime,2019,49,1,Completed High School,female,Viewer,Unemployed,Kids,2004,131,Spring,1041,4.6,A tapestry of emotions that tugged at my heartstrings.,9
The Uncharted Journey,2021,47,0,Completed College,female,Critic,Employed,Action/Adventure,2007,112,Fall,3948,1.7,A painful and frustrating viewing experience. Avoid.,7
The Last Crusade,2012,59,0,Post-Graduate,female,Viewer,Employed,Action/Adventure,2015,106,Winter,4492,2.9,I neither loved it nor hated it.,7
Enchanted Darkness,2009,35,1,Post-Graduate,male,Viewer,Unemployed,Horror,2009,139,Summer,7361,4,Truly heartwarming story.,3
A Glimpse Through Time,2019,42,3,Completed High School,female,Viewer,Employed,Other,1989,111,Fall,8842,3.3,An average outing that didn't leave a lasting impact.,10
Crimson Echoes,2008,53,0,Post-Graduate,male,Viewer,Employed,Drama,1995,139,Fall,955,3.2,"I was hoping for better, but it was decent enough.",10
Galactic Odyssey,2008,57,0,Completed High School,male,Critic,Employed,Sci-Fi,2010,113,Winter,3673,1.7,"This movie was a waste of my time. The plot was predictable, and the characters were unlikeable.",17
Odyssey of Legends,2011,39,1,Post-Graduate,male,Critic,Employed,Action/Adventure,2011,117,Fall,7179,2,A lackluster effort that failed to engage or entertain.,9
Eerie Echoes,2019,35,0,Post-Graduate,female,Critic,Employed,Horror,2018,112,Fall,9634,2.1,A movie that failed to deliver on its promises. Disappointing.,10
Crimson Echoes,2014,63,0,Completed College,female,Critic,Employed,Drama,1995,139,Fall,955,2.3,A total waste of time that I deeply regret.,9
Joyful Journeys,2020,44,1,Post-Graduate,female,Critic,Employed,Kids,2005,111,Spring,9030,3.1,"Some moments were good, others not so much.",8
Fading Memories,2006,24,0,Post-Graduate,male,Critic,Employed,Drama,2001,133,Winter,1885,2.1,A film that lacked any semblance of coherence or quality.,10
The Last Crusade,2021,18,0,Post-Graduate,female,Viewer,Employed,Action/Adventure,2015,106,Winter,4492,3,A movie that left me with mixed thoughts.,8
Lost Treasures,2019,63,0,Post-Graduate,female,Viewer,Employed,Action/Adventure,2009,144,Spring,4040,3.3,"It doesn't stand out, but it's not a total waste.",12
Stellar Explorers,2015,51,1,Post-Graduate,female,Viewer,Employed,Sci-Fi,2013,98,Fall,8106,2.9,A movie that didn't quite make a lasting impression.,10
Whimsical Whispers,2020,52,2,Completed High School,male,Viewer,Unemployed,Comedy,2020,113,Summer,6627,3.2,"It's an average movie, nothing to rave about.",9
Cursed Kingdom,2007,69,0,Completed College,male,Critic,Employed,Drama,2000,131,Summer,5101,2.4,A movie that left me uninterested and thoroughly unmoved.,9
Mystic Shadows,2015,72,0,Completed College,male,Viewer,Retired,Drama,2010,120,Summer,1455,3.6,An extraordinary journey that touched my soul.,7
The Adventurous Quest,2019,59,1,Completed College,female,Viewer,Employed,Action/Adventure,2011,108,Summer,9822,3.7,A mesmerizing and thought-provoking experience.,6
Hilarity Unleashed,2015,18,0,Post-Graduate,female,Viewer,Employed,Comedy,2019,121,Fall,7590,3,A film that left me on the fence with its execution.,11
Rolling on the Floor,2015,37,1,Post-Graduate,female,Viewer,Employed,Comedy,2015,129,Summer,410,2.9,An average journey that didn't fully engage me.,9
Chronicles of Destiny,2009,18,0,Completed High School,male,Viewer,Student,Action/Adventure,2000,125,Fall,4695,4,Bravo! A remarkable and soul-stirring experience.,7
Requiem for a Dream,2015,68,0,Post-Graduate,male,Viewer,Employed,Drama,2008,128,Winter,3517,3.5,Couldn't stop smiling!,4
Reflections of Reality,2010,31,0,Completed College,male,Viewer,Retired,Other,2019,132,Summer,2599,3.6,"An emotional and visual treat. The characters were well-developed, and the storyline was both heartwarming and profound. Highly recommended!",20
Soulbound,2007,18,0,Completed College,female,Viewer,Employed,Drama,2010,131,Fall,1618,3.6,A phenomenal performance.,3
Midnight Shadows,2016,41,0,Post-Graduate,female,Viewer,Retired,Horror,1995,140,Summer,4464,3.4,"It's a middle-of-the-road film, nothing extraordinary.",10
Fun Under the Sun,2013,36,0,Completed College,male,Viewer,Employed,Comedy,2019,123,Summer,7699,3.2,A film that lacked the impact I was hoping for.,10
Crazy Antics,2018,62,2,Completed College,female,Critic,Retired,Comedy,1992,131,Winter,6745,1.6,"I expected more, but this movie left me thoroughly dissatisfied.",10
Mystic Whispers,2021,37,0,Post-Graduate,female,Viewer,Employed,Drama,2010,122,Summer,857,3.8,"An instant classic, indeed.",4
The Last Crusade,2006,80,0,Post-Graduate,female,Critic,Unemployed,Action/Adventure,2015,106,Winter,4492,1.4,"I had high hopes for this movie, but it let me down in every way. The plot was confusing, and the acting was terrible.",24
Rolling on the Floor,2020,54,2,Completed High School,female,Critic,Employed,Comedy,2015,129,Summer,410,1.6,"A cinematic catastrophe. The plot was a jumbled mess, and the characters were unlikable.",14
