title,review_year,age,children_in_home,education,gender,reviewer_type,work_status,genre,release_year,length_minutes,season,total_reviews,rating,review_text,word_count
Beyond the Horizon,2018,50,1,Post-Graduate,female,Viewer,Employed,Action/Adventure,2010,107,Spring,6820,3.1,"I expected more, but it was just okay.",8
Lost Treasures,2014,44,2,Completed College,female,Critic,Retired,Action/Adventure,2009,144,Spring,4040,2.1,I couldn't find a single redeeming quality in this mess.,11
Epic Discovery,2015,18,0,Completed High School,female,Viewer,Employed,Action/Adventure,1994,130,Fall,7677,3.6,A must-watch masterpiece.,4
Requiem for a Dream,2021,75,0,Post-Graduate,female,Critic,Unemployed,Drama,2008,128,Winter,3517,2.2,A cinematic disaster that I wish I hadn't endured.,10
Dark Descent,2019,50,0,Post-Graduate,female,Viewer,Employed,Horror,2015,111,Spring,2185,2.9,"I wouldn't call it a masterpiece, but it wasn't terrible either.",13
Legends of Winter,2016,53,1,Completed High School,female,Viewer,Employed,Drama,2006,108,Fall,2617,3.3,Neither good nor bad. Just average. I wouldn't call it a masterpiece.,13
Beyond the Horizon,2012,65,0,Post-Graduate,female,Viewer,Employed,Action/Adventure,2010,107,Spring,6820,2.9,"It didn't exceed my expectations, but it wasn't bad.",11
Wanderlust,2009,43,0,Completed High School,male,Viewer,Employed,Other,1998,112,Summer,3716,3.3,"Not the best, but not the worst either.",8
Lost Treasures,2013,27,0,Post-Graduate,male,Viewer,Employed,Action/Adventure,2009,144,Spring,4040,3.3,"Not great, but not terrible. It falls somewhere in between.",10
Reflections of Reality,2018,40,1,Post-Graduate,female,Viewer,Employed,Other,2019,132,Summer,2599,3.8,"An absolute joy to watch. The humor is spot-on, and the characters are lovable.",15
Clash of Titans,2022,25,0,Completed College,male,Viewer,Student,Action/Adventure,2015,118,Summer,3638,4.2,An extraordinary journey that touched my soul.,7
The Mysterious Expedition,2008,58,0,Completed College,male,Critic,Employed,Action/Adventure,2016,145,Fall,5056,2.1,"A cinematic catastrophe. The plot was a jumbled mess, and the characters were unlikable.",14
Under the Rainbow,2021,40,0,Post-Graduate,female,Viewer,Employed,Kids,1996,122,Summer,530,3.2,This movie left me with a feeling of indifference.,9
Guardians of the Ancients,2001,42,1,Completed High School,female,Viewer,Unemployed,Action/Adventure,2014,116,Summer,3224,3.5,Riveting from start to finish - a true gem.,8
Raiders of the Unknown,2022,39,0,Completed High School,male,Viewer,Retired,Action/Adventure,2018,121,Summer,6957,3.9,A journey worth taking.,4
Raiders of the Unknown,2011,67,0,Completed High School,male,Critic,Retired,Action/Adventure,2018,121,Summer,6957,2.3,A lackluster attempt that left me bored and unenthusiastic.,9
Mystic Shadows,2019,20,0,Completed High School,female,Viewer,Employed,Drama,2010,120,Summer,1455,3.8,Filled with heart and captivating storytelling.,6
Beyond Boundaries,2018,42,1,Post-Graduate,female,Viewer,Employed,Other,2018,114,Fall,8184,3.6,A visual and emotional feast for the senses.,8
Crazy Antics,2005,18,0,Completed High School,male,Viewer,Employed,Comedy,1992,131,Winter,6745,2.9,An in-between experience that left me with mixed thoughts.,10
Crimson Echoes,2016,44,2,Post-Graduate,female,Viewer,Employed,Drama,1995,139,Fall,955,3.6,An exquisite blend of emotions and storytelling.,7
The Hilarious Movie,2015,45,1,Post-Graduate,female,Viewer,Employed,Comedy,2014,126,Winter,1399,2.6,A film that left me bewildered and utterly uninterested.,9
Lost Horizon,2019,52,0,Completed High School,female,Critic,Employed,Drama,2018,111,Spring,2643,2.2,A movie that left me uninterested and thoroughly unmoved.,9
Lost Treasures,2022,45,1,Post-Graduate,male,Critic,Employed,Action/Adventure,2009,144,Spring,4040,2.1,"A complete trainwreck of a movie. The acting was wooden, and the plot was a jumbled mess.",17
The Adventurous Quest,2003,58,0,Completed College,male,Viewer,Employed,Action/Adventure,2011,108,Summer,9822,3.4,"I wouldn't rush to see it again, but it was okay.",12
Whimsical Whispers,2014,45,1,Post-Graduate,male,Viewer,Employed,Comedy,2020,113,Summer,6627,2.9,A movie that fell short of my expectations.,8
Beyond the Horizon,2022,47,1,Post-Graduate,female,Viewer,Student,Action/Adventure,2010,107,Spring,6820,3.9,Lives up to its name. It's an enchanting story that explores the depths of human nature. The performances were exceptional.,21
Tales of Tiny Explorers,2019,73,0,Completed College,female,Viewer,Retired,Kids,2002,118,Fall,4368,3.2,"I didn't love it, but I didn't hate it either.",12
Under the Rainbow,2016,62,0,Post-Graduate,female,Critic,Employed,Kids,1996,122,Summer,530,1.7,A film that failed to capture my attention or imagination.,10
Secret of the Ancients,2016,74,0,Post-Graduate,male,Viewer,Employed,Action/Adventure,2020,115,Summer,9029,3.6,A genuine masterpiece that left me in awe.,8
Stolen Memories,2016,59,0,Post-Graduate,female,Viewer,Unemployed,Drama,2003,109,Summer,3004,3.5,Exceptional storytelling.,2
Beyond the Horizon,2016,35,1,Post-Graduate,female,Critic,Employed,Action/Adventure,2010,107,Spring,6820,1.9,A film that failed to capture my attention or imagination.,10
Mystic Whispers,2016,47,0,Post-Graduate,female,Viewer,Employed,Drama,2010,122,Summer,857,3.7,An instant classic that will be cherished for years.,9
Lost in Time,2022,18,0,Post-Graduate,male,Viewer,Student,Drama,2019,119,Summer,8311,4.8,Outstanding performances throughout.,3
Beyond the Horizon,2022,49,1,Post-Graduate,female,Viewer,Retired,Action/Adventure,2010,107,Spring,6820,3.3,"It didn't exceed my expectations, but it wasn't bad.",11
Guardians of Destiny,2008,42,1,Completed High School,female,Viewer,Employed,Action/Adventure,2004,119,Winter,374,2.9,"It's not remarkable, but it's not terrible either.",10
Whispers of Fate,2016,65,0,Completed High School,male,Critic,Employed,Drama,2009,102,Fall,8887,1.9,I wouldn't wish this movie on my worst enemy. It was a painful experience from start to finish.,19
Beyond the Horizon,2011,56,0,Completed High School,male,Viewer,Employed,Action/Adventure,2010,107,Spring,6820,3.1,An okay watch. Some parts were enjoyable.,7
Edge of Eternity,2016,67,0,Completed High School,female,Viewer,Employed,Drama,2018,104,Winter,4137,3.4,A watchable film that left me feeling neutral.,8
Enchanted Playtime,2019,80,0,Post-Graduate,female,Viewer,Retired,Kids,2004,131,Spring,1041,2.9,A narrative that fell somewhere in the middle ground.,9
Beyond the Horizon,2009,28,0,Post-Graduate,female,Viewer,Employed,Action/Adventure,2010,107,Spring,6820,3.1,An average outing that left me with mixed feelings.,9
Echoes of Eternity,2022,43,0,Post-Graduate,male,Viewer,Employed,Drama,1998,126,Summer,7245,4.2,Pure movie magic!,3
Love's Embrace,2014,44,2,Post-Graduate,female,Viewer,Employed,Romance,1983,112,Winter,9616,3.4,I neither loved it nor hated it. It didn't live up to the hype.,15
Eerie Echoes,2022,33,0,Post-Graduate,male,Viewer,Employed,Horror,2018,112,Fall,9634,3.6,A heartfelt and beautifully crafted cinematic journey.,7
Empire of Shadows,2009,80,0,Completed College,female,Viewer,Employed,Action/Adventure,2017,108,Summer,9606,3.5,"An instant classic, indeed.",4
Stellar Explorers,2011,26,2,Post-Graduate,female,Viewer,Employed,Sci-Fi,2013,98,Fall,8106,3,"It didn't leave a lasting impression, but it wasn't painful to watch.",14
Frozen in Time,2021,41,0,Post-Graduate,male,Viewer,Employed,Drama,1984,141,Winter,2736,3.6,"An emotional and visual treat. The characters were well-developed, and the storyline was both heartwarming and profound. Highly recommended!",20
Whimsical Whispers,2011,52,1,Post-Graduate,male,Viewer,Employed,Comedy,2020,113,Summer,6627,2.9,A movie that failed to leave a strong impact.,9
Unbreakable Bonds,2017,49,0,Post-Graduate,female,Critic,Employed,Romance,2015,121,Spring,6916,2,"Regret watching this, waste of time.",6
Whispers in the Dark,2020,43,0,Post-Graduate,male,Viewer,Employed,Horror,2020,130,Spring,2052,3.3,An adequate watch with its share of strengths and weaknesses.,10
Lost Horizon,2016,40,1,Post-Graduate,female,Viewer,Employed,Drama,2018,111,Spring,2643,3.5,A cinematic triumph!,3
Secret of the Ancients,2014,45,0,Post-Graduate,female,Critic,Employed,Action/Adventure,2020,115,Summer,9029,2.3,An uninspired mess that left me wondering why it was made.,11
Galactic Odyssey,2015,34,0,Completed College,male,Viewer,Employed,Sci-Fi,2010,113,Winter,3673,3.2,An average journey that didn't evoke strong reactions.,9
Fading Memories,2014,35,1,Post-Graduate,male,Viewer,Employed,Drama,2001,133,Winter,1885,3.7,A work of pure genius.,5
Endless Love,2020,63,0,Post-Graduate,male,Viewer,Employed,Romance,2016,147,Spring,3185,3.3,"I wouldn't call it a masterpiece, but it wasn't terrible either.",13
Whimsical Whispers,2006,75,0,Completed College,female,Viewer,Retired,Comedy,2020,113,Summer,6627,2.9,Meh. It was neither great nor terrible. I had mixed feelings about this one.,14
Frozen in Time,2007,26,2,Post-Graduate,female,Viewer,Employed,Drama,1984,141,Winter,2736,3.4,A middle-of-the-road watch that left me feeling neutral.,11
Love's Embrace,2014,44,0,Post-Graduate,male,Viewer,Employed,Romance,1983,112,Winter,9616,3.2,A film that didn't fully engage me but had its moments.,12
Eerie Echoes,2020,59,0,Completed College,male,Viewer,Employed,Horror,2018,112,Fall,9634,3.5,A must-watch masterpiece.,4
Midnight Shadows,2005,51,1,Post-Graduate,female,Viewer,Employed,Horror,1995,140,Summer,4464,3.5,A tale of courage and triumph that left me breathless.,10
Wanderlust,2022,75,0,Completed College,female,Viewer,Unemployed,Other,1998,112,Summer,3716,3.2,A middle-of-the-road watch that left me feeling neutral.,11
Beyond the Horizon,2015,33,0,Post-Graduate,female,Critic,Employed,Action/Adventure,2010,107,Spring,6820,1.7,A disaster from start to finish. Save yourself the agony.,10
Joyful Journeys,2014,36,0,Post-Graduate,male,Critic,Employed,Kids,2005,111,Spring,9030,1.9,"I expected more, but this movie left me utterly disappointed.",10
Legends Reborn,2012,55,0,Post-Graduate,female,Critic,Student,Action/Adventure,2008,116,Fall,5896,2.4,An uninspired mess that left me wondering why I bothered.,10
Enchanted Expeditions,2013,38,2,Post-Graduate,female,Critic,Employed,Action/Adventure,2017,109,Summer,1969,1.8,A complete waste of time that I deeply regret.,9
Echoes of Eternity,2010,80,0,Post-Graduate,female,Viewer,Retired,Drama,1998,126,Summer,7245,3.9,Top-notch entertainment!,3
A Glimpse Through Time,2011,35,1,Post-Graduate,male,Viewer,Employed,Other,1989,111,Fall,8842,3.3,A neutral watch that didn't evoke strong emotions.,9
Eternal Sunshine,2017,52,0,Post-Graduate,female,Critic,Employed,Drama,2017,142,Summer,4603,2.6,A film that fell short of every expectation. Disappointing.,9
Enchanted Expeditions,2021,64,0,Completed College,male,Viewer,Employed,Action/Adventure,2017,109,Summer,1969,3.2,"I wouldn't call it memorable, just a typical movie.",10
Unbreakable Bonds,2004,24,0,Completed High School,female,Viewer,Employed,Romance,2015,121,Spring,6916,3.6,Overflowing with charm and genuine heart.,6
Realm of Illusions,2018,67,0,Completed College,male,Viewer,Employed,Drama,2005,112,Summer,1520,3.5,Incredible storytelling and breathtaking visuals. I couldn't take my eyes off the screen.,14
Eternal Echoes,2012,18,0,Completed College,male,Viewer,Unemployed,Drama,1992,136,Summer,7130,4.2,A true cinematic gem.,4
Under the Rainbow,2022,27,1,Post-Graduate,female,Critic,Employed,Kids,1996,122,Summer,530,3.1,"It's an average film, nothing more, nothing less.",9
Innocence Lost,2009,80,0,Completed College,male,Viewer,Retired,Drama,2011,131,Summer,3260,3.8,A heartwarming tale that warmed my soul.,7
The Uncharted Journey,2011,66,0,Completed College,male,Viewer,Employed,Action/Adventure,2007,112,Fall,3948,2.9,"It's an average movie, nothing to rave about.",9
Chronicles of Destiny,2015,27,1,Completed College,female,Viewer,Employed,Action/Adventure,2000,125,Fall,4695,3.5,Brilliant acting and direction.,4
Whispers of Hope,2015,18,0,Post-Graduate,female,Viewer,Employed,Drama,2018,120,Summer,389,3.7,A film to remember.,4
Tales of Tiny Explorers,2008,18,0,Completed College,female,Viewer,Student,Kids,2002,118,Fall,4368,3.6,"A must-see for everyone. This film has it all - action, emotion, and a powerful message.",16
Silly Adventures,2011,80,0,Completed High School,female,Critic,Retired,Comedy,2018,127,Summer,607,1.2,A lackluster effort that fell flat in every possible way.,10
Echoes of Eternity,2017,72,0,Completed High School,female,Viewer,Employed,Drama,1998,126,Summer,7245,4.1,A captivating masterpiece that left me speechless.,7
Unseen Horizons,2013,29,1,Post-Graduate,male,Viewer,Unemployed,Drama,2010,127,Summer,7985,4.4,Brilliant acting and direction.,4
Frozen in Time,2012,18,0,Completed College,female,Viewer,Student,Drama,1984,141,Winter,2736,4.1,A remarkable testament to the power of storytelling.,8
Magic of Childhood,2020,80,0,Post-Graduate,male,Viewer,Retired,Kids,2014,126,Winter,1036,3,"It's just an average movie, nothing special.",8
Fun Under the Sun,2013,63,0,Post-Graduate,female,Critic,Employed,Comedy,2019,123,Summer,7699,1.5,Total letdown.,2
Cursed Kingdom,2016,31,1,Completed College,female,Viewer,Employed,Drama,2000,131,Summer,5101,4.3,"Wow, what a great film!",5
Guardians of Destiny,2009,42,3,Completed College,female,Viewer,Employed,Action/Adventure,2004,119,Winter,374,3,"It didn't exceed my expectations, but it wasn't bad.",11
The Mysterious Expedition,2022,76,0,Completed College,female,Viewer,Retired,Action/Adventure,2016,145,Fall,5056,3.5,A symphony of emotions that left me deeply touched.,9
Quest for Glory,2014,65,0,Post-Graduate,male,Viewer,Employed,Action/Adventure,2009,140,Spring,8533,3.5,A mesmerizing and emotionally resonant triumph.,6
Fun Under the Sun,2014,22,0,Completed High School,female,Viewer,Unemployed,Comedy,2019,123,Summer,7699,3.2,It's neither remarkable nor terrible.,6
Chronicles of Courage,2016,51,1,Post-Graduate,male,Viewer,Employed,Action/Adventure,1995,132,Summer,1983,3.4,"I wouldn't call it memorable, just a typical movie.",10
The Last Crusade,2010,66,0,Completed College,female,Viewer,Employed,Action/Adventure,2015,106,Winter,4492,2.9,A so-so experience that didn't quite connect.,9
The Enigmatic Drama,2019,61,0,Completed College,female,Critic,Employed,Drama,2018,118,Summer,5690,2.7,A film that left me baffled and questioning its existence.,10
Romancing the Heart,2021,62,0,Post-Graduate,female,Viewer,Unemployed,Romance,2016,113,Summer,9860,3.7,A cinematic triumph!,3
Rising Stars,2021,33,1,Post-Graduate,female,Viewer,Unemployed,Drama,2000,112,Summer,2889,3.9,A symphony of emotions that left me deeply touched.,9
Unbreakable Bonds,2022,57,1,Post-Graduate,male,Critic,Employed,Romance,2015,121,Spring,6916,2.2,A film that fell short of every expectation. Disheartening.,9
Stolen Memories,2021,80,0,Completed High School,male,Viewer,Employed,Drama,2003,109,Summer,3004,3.5,Absolutely loved this movie! A true masterpiece. The brilliant storytelling and exceptional performances kept me engaged from start to finish. It's a must-watch for anyone who appreciates meaningful cinema.,31
Romancing the Heart,2022,18,0,Completed College,female,Viewer,Student,Romance,2016,113,Summer,9860,4.9,Epic storytelling at its best.,5
Laughter Therapy,2011,20,0,Completed College,male,Viewer,Employed,Comedy,1996,143,Summer,2829,2.9,A so-so narrative that left me feeling indifferent.,9
Reflections of Reality,2021,75,0,Completed College,female,Viewer,Retired,Other,2019,132,Summer,2599,3.7,An extraordinary journey that left me inspired.,7
Fading Memories,2022,80,0,Completed College,male,Viewer,Retired,Drama,2001,133,Winter,1885,3.6,Bravo! A remarkable and soul-stirring experience.,7
Empire of Shadows,2009,75,0,Completed High School,male,Viewer,Retired,Action/Adventure,2017,108,Summer,9606,3.6,Movie perfection achieved.,3
Mystic Whispers,2013,66,0,Post-Graduate,female,Viewer,Employed,Drama,2010,122,Summer,857,3.4,A so-so narrative that left me feeling indifferent.,9
Cosmic Adventures,2017,52,0,Post-Graduate,female,Viewer,Employed,Sci-Fi,2012,119,Fall,8655,3.4,"It's neither here nor there, just an average movie.",10
Visions of Valor,2020,45,1,Completed College,female,Viewer,Retired,Action/Adventure,1987,120,Fall,2574,3.3,"Some moments were good, others not so much.",8
Whispers of Fate,2021,70,0,Post-Graduate,female,Critic,Retired,Drama,2009,102,Fall,8887,2,A complete waste of time that I deeply regret.,9
Tales of Tiny Explorers,2010,18,0,Completed College,male,Viewer,Student,Kids,2002,118,Fall,4368,3.8,A work of art that transcends the ordinary.,8
Laughing Waters,2013,79,0,Completed High School,male,Viewer,Retired,Comedy,2006,126,Spring,768,2.2,A trainwreck of a film that I wish I hadn't seen.,12
Shadowed Past,2011,42,0,Post-Graduate,female,Critic,Employed,Drama,2017,103,Summer,4038,1.9,"Lousy acting, couldn't stand it.",6
Journey to the Unknown,2022,74,0,Completed High School,female,Viewer,Employed,Action/Adventure,2000,107,Summer,2537,3.1,"There are parts I liked, but overall, it's average.",10
Clash of Titans,2020,39,0,Post-Graduate,male,Viewer,Employed,Action/Adventure,2015,118,Summer,3638,3.5,This film is a triumph of storytelling. It's a moving and powerful experience that stays with you.,18
The Last Crusade,2018,80,0,Post-Graduate,male,Viewer,Retired,Action/Adventure,2015,106,Winter,4492,2.8,"I can't say I loved it, but I didn't hate it either.",14
Eternal Love,2019,44,0,Post-Graduate,female,Viewer,Employed,Romance,2014,108,Fall,997,2.7,"I had high hopes for this movie, but it let me down in every way. The acting was wooden, and the plot was a mess.",25
Enchanted Darkness,2009,36,1,Completed High School,female,Viewer,Employed,Horror,2009,139,Summer,7361,3.9,This movie is a shining beacon of creativity.,8
Guardians of Destiny,2021,59,0,Completed College,male,Viewer,Employed,Action/Adventure,2004,119,Winter,374,3,"It wasn't remarkable, but it wasn't awful either.",10
Whispers of Hope,2019,34,1,Completed High School,female,Viewer,Employed,Drama,2018,120,Summer,389,4,An extraordinary journey that left me inspired.,7
Cosmic Adventures,2022,48,2,Completed College,female,Critic,Employed,Sci-Fi,2012,119,Fall,8655,2.4,"A cinematic catastrophe. The plot was a jumbled mess, and the characters were unlikable.",14
Beyond the Stars,2008,77,0,Completed High School,female,Critic,Employed,Sci-Fi,1997,133,Summer,3305,2.1,A film that lacked direction and substance. Avoid at all costs.,11
Echoes of Eternity,2010,18,0,Post-Graduate,male,Viewer,Student,Drama,1998,126,Summer,7245,4.7,A cinematic masterpiece.,3
Whispers of Hope,2005,28,1,Post-Graduate,male,Viewer,Employed,Drama,2018,120,Summer,389,3.7,Mesmerizing and thought-provoking. A true masterpiece.,7
Whispers of Fate,2015,48,1,Post-Graduate,male,Viewer,Employed,Drama,2009,102,Fall,8887,3.5,An instant classic that will be cherished for years.,9
Legends Reborn,2021,80,0,Completed College,female,Critic,Employed,Action/Adventure,2008,116,Fall,5896,1.9,A movie that left me uninterested and thoroughly unmoved.,9
Beyond Boundaries,2007,62,0,Post-Graduate,female,Critic,Employed,Other,2018,114,Fall,8184,1.9,Disappointing movie.,2
Chronicles of Destiny,2021,31,0,Completed High School,female,Critic,Employed,Action/Adventure,2000,125,Fall,4695,2,"Complete letdown, don't bother.",5
Epic Discovery,2016,51,1,Post-Graduate,male,Viewer,Employed,Action/Adventure,1994,130,Fall,7677,3.5,An unforgettable experience.,3
Under the Rainbow,2021,53,0,Completed High School,female,Viewer,Employed,Kids,1996,122,Summer,530,3.2,Meh. It was neither great nor terrible.,7
Chronicles of Destiny,2003,43,0,Completed College,male,Critic,Employed,Action/Adventure,2000,125,Fall,4695,1.8,I couldn't connect with the story or characters at all.,11
Reflections of Reality,2013,47,1,Completed College,male,Viewer,Retired,Other,2019,132,Summer,2599,3.7,Powerful and poignant. A truly remarkable achievement.,7
Crazy Antics,2020,25,0,Post-Graduate,male,Viewer,Unemployed,Comedy,1992,131,Winter,6745,2.8,A film that didn't leave a lasting mark.,9
Love in the Air,2011,52,2,Completed College,female,Viewer,Employed,Romance,2018,130,Summer,6969,3.9,Couldn't stop smiling!,4
Lost Treasures,2018,25,1,Completed High School,female,Viewer,Employed,Action/Adventure,2009,144,Spring,4040,3.6,A true masterpiece that shines in every scene.,8
Cursed Kingdom,2009,65,0,Post-Graduate,male,Critic,Employed,Drama,2000,131,Summer,5101,2.4,"I can't believe I wasted my time on this garbage. The story made no sense, and I couldn't care less about the characters.",25
Eternal Sunshine,2021,21,0,Post-Graduate,male,Viewer,Unemployed,Drama,2017,142,Summer,4603,4.1,A stunning testament to the power of cinema.,8
Eternal Echoes,2008,65,0,Completed College,male,Viewer,Unemployed,Drama,1992,136,Summer,7130,4,A work of art that transcends the ordinary.,8
Journey to the Unknown,2008,71,0,Completed College,female,Viewer,Retired,Action/Adventure,2000,107,Summer,2537,3,"It's not a standout film, but it's not terrible either.",12
Legends Unleashed,2010,69,0,Completed College,male,Viewer,Employed,Action/Adventure,2009,127,Summer,4095,3.5,"An emotional and visual treat. The characters were well-developed, and the storyline was both heartwarming and profound. Highly recommended!",20
Hilarity Unleashed,2016,80,0,Post-Graduate,male,Critic,Retired,Comedy,2019,121,Fall,7590,1.5,"I expected so much more from this film, but it fell flat. Boring and uninspired, it left me with a sense of wasted potential.",24
Echoes of Eternity,2011,18,1,Completed College,male,Viewer,Student,Drama,1998,126,Summer,7245,4.8,Filled with wonder and moments of sheer brilliance.,8
Legends of Winter,2007,30,1,Completed College,male,Viewer,Employed,Drama,2006,108,Fall,2617,3.4,"It had potential, but it didn't fully deliver.",9
Whispers of Hope,2016,18,0,Post-Graduate,female,Viewer,Employed,Drama,2018,120,Summer,389,3.7,An emotional tour de force that left me moved.,9
Quest for the Crystal,2018,46,1,Post-Graduate,male,Viewer,Employed,Action/Adventure,1996,109,Summer,3611,3.3,A watchable effort that didn't quite stand out.,9
The Last Crusade,2021,20,0,Completed College,male,Viewer,Employed,Action/Adventure,2015,106,Winter,4492,3.1,An average outing that didn't evoke strong reactions.,9
Giggles and Grins,2009,51,0,Post-Graduate,female,Viewer,Employed,Comedy,2012,110,Winter,9926,2.6,A total misfire that left me questioning my movie choices.,10
Forgotten Realms,2020,44,1,Post-Graduate,female,Critic,Employed,Drama,2013,129,Summer,3337,2.7,"One of the worst movies I've ever seen. It was painful to sit through. The plot made no sense, and the acting was atrocious.",25
The Mysterious Expedition,2006,18,0,Completed College,male,Viewer,Employed,Action/Adventure,2016,145,Fall,5056,3.6,A cinematic treasure that left me deeply moved.,8
Wonderland Adventures,2014,54,0,Completed College,female,Viewer,Unemployed,Kids,2012,98,Spring,2160,2.6,"Terrible. Just terrible. The script was terrible, the acting was terrible, and I regret ever watching it.",17
Tales of Tiny Explorers,2021,71,0,Completed College,male,Viewer,Employed,Kids,2002,118,Fall,4368,3.1,A neutral watch that didn't evoke strong emotions.,9
Rise of the Phoenix,2006,32,1,Completed College,male,Critic,Employed,Action/Adventure,2006,126,Winter,6613,2.2,An uninspired mess that left me utterly unimpressed.,8
Requiem for a Dream,2021,18,0,Completed College,female,Viewer,Student,Drama,2008,128,Winter,3517,4.6,I was hooked from the first scene. The suspense and excitement never let up. A must-see thriller!,18
Lost Treasures,2006,69,0,Completed High School,female,Viewer,Employed,Action/Adventure,2009,144,Spring,4040,3.1,Neither good nor bad. Just average.,6
Shattered Reflections,2014,50,0,Completed College,male,Viewer,Employed,Drama,2017,125,Spring,2500,3.8,A masterpiece of cinema.,4
The Last Crusade,2022,75,0,Completed College,male,Critic,Retired,Action/Adventure,2015,106,Winter,4492,1.6,"I wouldn't recommend this movie to anyone. It was boring, poorly acted, and had a terrible script.",18
Beneath the Surface,2018,33,1,Post-Graduate,male,Viewer,Employed,Drama,2011,105,Fall,9202,3.7,"An absolute joy to watch. The humor is spot-on, and the characters are lovable.",15
Midnight Whispers,2020,29,0,Completed High School,female,Viewer,Employed,Drama,2012,115,Summer,9341,4.3,Exceptional storytelling.,2
Stellar Explorers,2015,67,0,Completed High School,female,Viewer,Employed,Sci-Fi,2013,98,Fall,8106,2.8,"I can't say I loved it, but I didn't hate it either.",14
Shadowed Past,2007,75,0,Completed College,male,Viewer,Retired,Drama,2017,103,Summer,4038,3.3,"There are parts I liked, but overall, it's average.",10
Whispers of Hope,2016,20,0,Completed High School,female,Viewer,Student,Drama,2018,120,Summer,389,4.4,A mesmerizing and emotionally resonant triumph.,6
Quest for the Crystal,2021,57,0,Post-Graduate,male,Viewer,Retired,Action/Adventure,1996,109,Summer,3611,3.1,"It's a film that falls in between. Not remarkable, not terrible.",12
Clash of Titans,2019,56,0,Post-Graduate,female,Viewer,Employed,Action/Adventure,2015,118,Summer,3638,3.3,A narrative that fell somewhere in the middle for me.,10
Broken Promises,2022,51,0,Post-Graduate,female,Critic,Employed,Drama,2008,125,Fall,5560,2.4,"I wanted to like this movie, but it was a disappointment. The story felt rushed, and the characters lacked depth.",20
Laughter Therapy,2021,49,1,Completed College,female,Viewer,Unemployed,Comedy,1996,143,Summer,2829,3,"A decent movie, but it didn't quite meet my expectations. Some parts were enjoyable.",15
Crazy Antics,2013,34,0,Post-Graduate,male,Critic,Employed,Comedy,1992,131,Winter,6745,1.3,A cinematic disaster that I wish I hadn't endured.,10
Unseen Horizons,2021,35,2,Completed College,female,Viewer,Employed,Drama,2010,127,Summer,7985,4.6,A captivating masterpiece that left me speechless.,7
Forgotten Realms,2006,18,0,Completed High School,female,Viewer,Student,Drama,2013,129,Summer,3337,4.6,A triumph of storytelling and visual splendor.,7
