title,review_year,age,children_in_home,education,gender,reviewer_type,work_status,genre,release_year,length_minutes,season,total_reviews,rating,review_text,word_count
Adventures of the Little Ones,2014,61,1,Completed College,male,Viewer,Employed,Kids,1997,124,Summer,8607,5,A stunning testament to the power of cinema.,8
Midnight Shadows,2006,43,1,Post-Graduate,female,Viewer,Employed,Horror,1995,140,Summer,4464,3.5,Emotional rollercoaster ride.,3
Secret of the Ancients,2021,33,0,Completed College,female,Critic,Employed,Action/Adventure,2020,115,Summer,9029,2.7,"Not worth your money, disappointing.",5
Dark Descent,2006,44,0,Completed College,female,Viewer,Unemployed,Horror,2015,111,Spring,2185,2.8,An average outing that left me with mixed feelings.,9
Echoes of Valor,2006,18,0,Post-Graduate,female,Viewer,Employed,Action/Adventure,2020,114,Winter,5527,3.2,"Some moments were good, others not so much.",8
Beyond the Horizon,2022,23,0,Post-Graduate,female,Viewer,Employed,Action/Adventure,2010,107,Spring,6820,3.2,A film that didn't fully connect with me.,9
A Glimpse Through Time,2010,48,1,Completed College,female,Viewer,Employed,Other,1989,111,Fall,8842,3.3,A passable cinematic endeavor that didn't stand out.,9
Beneath the Surface,2012,18,0,Completed College,female,Viewer,Student,Drama,2011,105,Fall,9202,4.3,A heartfelt and beautifully realized masterpiece.,6
Realm of Legends,2015,45,0,Completed College,female,Viewer,Unemployed,Action/Adventure,1996,116,Summer,7968,3.8,A stunning testament to the power of cinema.,8
Giggles and Grins,2019,49,0,Post-Graduate,female,Critic,Employed,Comedy,2012,110,Winter,9926,1.3,"I can't believe I wasted money on a ticket to see this. The characters were one-dimensional, and the story was dull and uninspired.",25
Rising Stars,2022,18,0,Post-Graduate,female,Critic,Student,Drama,2000,112,Summer,2889,2.8,An average effort that lacked a distinct spark.,8
Innocence Lost,2019,61,0,Completed College,male,Viewer,Employed,Drama,2011,131,Summer,3260,3.9,Impressed by every aspect.,4
The Uncharted Journey,2021,28,1,Post-Graduate,female,Critic,Student,Action/Adventure,2007,112,Fall,3948,2.4,An uninspired and regrettable mess that left me unsatisfied.,9
Quest for Glory,2020,48,1,Completed College,male,Critic,Employed,Action/Adventure,2009,140,Spring,8533,2.5,"Not worth your money, disappointing.",5
Tales of Tiny Explorers,2017,18,0,Completed High School,male,Critic,Student,Kids,2002,118,Fall,4368,2.4,A complete waste of time that I deeply regret.,9
Clash of Titans,2022,42,0,Post-Graduate,female,Critic,Employed,Action/Adventure,2015,118,Summer,3638,2,"I expected more, but this movie left me thoroughly disappointed.",10
Realm of Illusions,2012,67,0,Post-Graduate,female,Viewer,Employed,Drama,2005,112,Summer,1520,3.4,An average watch that didn't leave a strong impression.,10
Legends of Winter,2012,59,0,Post-Graduate,male,Critic,Employed,Drama,2006,108,Fall,2617,1.7,"Lousy acting, couldn't stand it.",6
Chronicles of Courage,2021,30,1,Post-Graduate,female,Viewer,Employed,Action/Adventure,1995,132,Summer,1983,3.4,An average journey that didn't fully engage me.,9
Lost in Time,2021,62,0,Post-Graduate,female,Viewer,Employed,Drama,2019,119,Summer,8311,4.1,A journey of discovery that left me spellbound.,8
Whispers of Fate,2000,80,0,Post-Graduate,female,Viewer,Retired,Drama,2009,102,Fall,8887,3.1,A film that didn't leave a lasting impact.,9
Eternal Sunshine,2008,42,1,Completed College,male,Viewer,Employed,Drama,2017,142,Summer,4603,4.2,A symphony of emotions that left me deeply touched.,9
Secret of the Ancients,2022,69,0,Post-Graduate,male,Critic,Employed,Action/Adventure,2020,115,Summer,9029,2.3,A lackluster attempt that fell short in every way.,9
Dark Descent,2013,58,1,Post-Graduate,female,Viewer,Employed,Horror,2015,111,Spring,2185,3,A film that didn't fully engage me but had its moments.,12
Joyful Journeys,2018,40,0,Completed High School,female,Viewer,Employed,Kids,2005,111,Spring,9030,3.4,"I expected more from it, but it was passable.",9
Broken Promises,2022,71,0,Post-Graduate,male,Critic,Retired,Drama,2008,125,Fall,5560,2.3,Waste of time.,3
Chronicles of Courage,2018,18,0,Completed High School,male,Viewer,Unemployed,Action/Adventure,1995,132,Summer,1983,3.6,Deserves all the praise.,4
Frozen in Time,2021,43,0,Completed High School,female,Critic,Employed,Drama,1984,141,Winter,2736,2.3,A total letdown that I wouldn't wish upon anyone.,10
Enchanted Hearts,2020,71,0,Post-Graduate,male,Viewer,Retired,Romance,2019,137,Summer,9467,3.9,A masterpiece that redefines cinematic excellence.,6
Midnight Shadows,2008,60,0,Post-Graduate,male,Viewer,Retired,Horror,1995,140,Summer,4464,3.3,A neutral watch that neither impressed nor disappointed.,8
Tales of Tiny Explorers,2018,60,0,Completed College,female,Viewer,Employed,Kids,2002,118,Fall,4368,3.1,A film that didn't fully connect with me.,9
Soulbound,2019,77,0,Post-Graduate,female,Viewer,Retired,Drama,2010,131,Fall,1618,3.4,A middle-of-the-road outing that left me with mixed feelings.,12
Amour Forever,2012,47,1,Post-Graduate,female,Viewer,Employed,Romance,2004,134,Fall,6251,3.6,Brilliant acting and direction.,4
Sweet Serenade,2022,55,0,Completed High School,male,Viewer,Unemployed,Romance,1996,118,Fall,3730,3.2,"It had its moments, but overall, it was just okay.",10
Unseen Horizons,2021,60,0,Completed College,male,Viewer,Employed,Drama,2010,127,Summer,7985,4.3,Spectacular and moving.,3
Magic of Childhood,2000,28,3,Completed High School,female,Viewer,Employed,Kids,2014,126,Winter,1036,4.3,"A breathtaking masterpiece that left me speechless. The storytelling, visuals, and performances were exceptional.",14
Epic Discovery,2022,59,0,Completed High School,male,Viewer,Employed,Action/Adventure,1994,130,Fall,7677,3.7,Unforgettable movie moments.,3
Eternal Sunshine,2013,64,0,Post-Graduate,male,Viewer,Employed,Drama,2017,142,Summer,4603,3.9,Incredible storytelling here.,3
Beneath the Surface,2016,33,0,Completed College,male,Viewer,Employed,Drama,2011,105,Fall,9202,3.7,Overflowing with heart and genuine emotion.,6
Fun Under the Sun,2018,20,0,Completed College,female,Viewer,Employed,Comedy,2019,123,Summer,7699,3.4,A watchable film that left me feeling neutral.,8
Whispers of Hope,2017,41,0,Post-Graduate,female,Critic,Employed,Drama,2018,120,Summer,389,2.2,An utterly forgettable and regrettable cinematic endeavor.,7
Lost Treasures,2003,46,0,Post-Graduate,female,Viewer,Employed,Action/Adventure,2009,144,Spring,4040,3.2,"It's neither here nor there, just an average movie.",10
Reflections of Reality,2017,32,0,Completed High School,male,Viewer,Employed,Other,2019,132,Summer,2599,3.7,A cinematic gem that shines brightly in the industry.,9
Stellar Explorers,2004,26,0,Post-Graduate,female,Viewer,Employed,Sci-Fi,2013,98,Fall,8106,2.9,"It had its moments, but overall, it was just okay. I neither loved it nor hated it.",17
Shadowed Past,2013,58,0,Completed High School,female,Viewer,Employed,Drama,2017,103,Summer,4038,3.5,A true work of art that captures the essence of life.,11
Tales of Tiny Explorers,2014,27,0,Post-Graduate,female,Viewer,Employed,Kids,2002,118,Fall,4368,3.1,"It didn't wow me, but it was watchable. A so-so film with some redeeming qualities.",17
Wonderland Adventures,2017,51,0,Post-Graduate,male,Critic,Employed,Kids,2012,98,Spring,2160,1,A movie that failed to live up to its potential. Avoid.,11
Epic Discovery,2022,52,1,Completed College,female,Viewer,Employed,Action/Adventure,1994,130,Fall,7677,3.8,An emotional rollercoaster that pulled at my heartstrings.,8
Shadowed Past,2012,67,0,Completed College,female,Viewer,Employed,Drama,2017,103,Summer,4038,3.5,A treasure trove of beauty and inspiration.,7
Enchanted Darkness,2019,45,1,Completed High School,female,Critic,Employed,Horror,2009,139,Summer,7361,2.6,"A truly awful movie. The special effects were laughable, and the dialogue was cringe-worthy. Avoid at all costs.",19
Amour Forever,2022,18,0,Completed High School,female,Critic,Student,Romance,2004,134,Fall,6251,3.2,"Not the best, but it was bearable.",7
Empire of Shadows,2015,57,0,Post-Graduate,female,Critic,Student,Action/Adventure,2017,108,Summer,9606,2.7,An uninspired and regrettable mess that left me unsatisfied.,9
Beyond the Horizon,2021,43,0,Post-Graduate,female,Critic,Employed,Action/Adventure,2010,107,Spring,6820,1.7,Disappointing movie.,2
Journey to the Unknown,2021,77,0,Post-Graduate,male,Viewer,Retired,Action/Adventure,2000,107,Summer,2537,3,"It didn't leave a lasting impression, but it wasn't painful to watch.",14
Quest for the Crystal,2015,56,1,Completed College,male,Critic,Employed,Action/Adventure,1996,109,Summer,3611,1.8,A trainwreck of a film that I wish I hadn't seen.,12
Amour Forever,2021,18,0,Post-Graduate,male,Viewer,Employed,Romance,2004,134,Fall,6251,4,A genuine masterpiece that left me in awe.,8
Enchanted Expeditions,2019,47,0,Post-Graduate,male,Viewer,Employed,Action/Adventure,2017,109,Summer,1969,3.1,It's hard to form a strong opinion about it.,10
The Last Crusade,2020,24,0,Post-Graduate,female,Viewer,Employed,Action/Adventure,2015,106,Winter,4492,2.9,A film that was neither remarkable nor disappointing.,8
The Hilarious Movie,2011,18,1,Post-Graduate,female,Viewer,Employed,Comedy,2014,126,Winter,1399,2.6,A complete waste of time that I won't get back.,11
Endless Love,2022,62,0,Post-Graduate,female,Viewer,Employed,Romance,2016,147,Spring,3185,3.3,It's neither remarkable nor terrible.,6
Beyond the Stars,2021,18,0,Post-Graduate,male,Viewer,Student,Sci-Fi,1997,133,Summer,3305,4.1,An unforgettable experience! The deep emotional connections and the exploration of human nature in this movie were thought-provoking. I highly recommend it.,23
Cosmic Adventures,2007,78,0,Post-Graduate,female,Critic,Retired,Sci-Fi,2012,119,Fall,8655,1.8,A forgettable experience that left me questioning its merit.,9
Fun Under the Sun,2012,38,0,Post-Graduate,female,Viewer,Employed,Comedy,2019,123,Summer,7699,3.1,"Some scenes were interesting, others were forgettable.",7
Secret of the Ancients,2011,32,0,Post-Graduate,female,Viewer,Employed,Action/Adventure,2020,115,Summer,9029,3.6,This movie is pure magic. It captures the essence of childhood dreams and takes you on an adventure.,18
Galactic Odyssey,2020,27,0,Post-Graduate,female,Viewer,Retired,Sci-Fi,2010,113,Winter,3673,3.1,An okay experience that didn't fully connect.,8
Unseen Horizons,2021,18,0,Post-Graduate,male,Viewer,Student,Drama,2010,127,Summer,7985,4.8,An unforgettable experience.,3
Heartstrings,2021,53,1,Completed High School,female,Critic,Employed,Romance,1991,123,Summer,5066,2.2,A lackluster effort that failed to engage or entertain.,9
Beyond the Stars,2018,18,0,Completed College,female,Viewer,Student,Sci-Fi,1997,133,Summer,3305,4.3,Absolutely brilliant movie!,3
Legends of Winter,2019,51,1,Post-Graduate,female,Viewer,Employed,Drama,2006,108,Fall,2617,3.3,"I didn't love it, but I didn't hate it either. It didn't exceed my expectations.",18
Beyond the Stars,2021,24,0,Post-Graduate,female,Viewer,Employed,Sci-Fi,1997,133,Summer,3305,3.6,An absolute delight! The humor and heart in this movie make it an instant classic. Loved every minute of it.,20
Lost in Time,2017,55,0,Post-Graduate,female,Critic,Employed,Drama,2019,119,Summer,8311,2.6,A movie that failed to deliver on its promises. Avoid at all costs.,13
Odyssey of Legends,2013,60,0,Post-Graduate,female,Critic,Employed,Action/Adventure,2011,117,Fall,7179,1.8,This film was so bad it's almost impressive. I can't think of a single redeeming quality.,18
Broken Promises,2021,50,1,Post-Graduate,male,Viewer,Employed,Drama,2008,125,Fall,5560,3.9,A cinematic triumph that left me in awe.,8
Chronicles of Destiny,2019,18,0,Post-Graduate,female,Viewer,Student,Action/Adventure,2000,125,Fall,4695,3.8,"An absolute masterpiece! The performances, the music, and the visuals are all top-notch.",14
Unbreakable Bonds,2020,18,1,Post-Graduate,female,Viewer,Student,Romance,2015,121,Spring,6916,4.6,Impressed by every aspect.,4
Crimson Echoes,2008,80,0,Completed College,male,Viewer,Retired,Drama,1995,139,Fall,955,3.4,An adequate effort that didn't quite shine.,8
The Uncharted Journey,2021,78,0,Completed College,male,Critic,Retired,Action/Adventure,2007,112,Fall,3948,1.7,Predictable and utterly unimpressive.,4
Love in the Air,2010,45,0,Completed High School,male,Viewer,Employed,Romance,2018,130,Summer,6969,3.8,Cinematic excellence shines.,3
Mystic Whispers,2010,64,0,Completed High School,female,Critic,Employed,Drama,2010,122,Summer,857,2.3,"The worst film I've seen in years. It was painful to sit through, and I left the theater feeling angry and cheated.",23
Giggles and Grins,2022,21,0,Post-Graduate,male,Viewer,Student,Comedy,2012,110,Winter,9926,4.2,A true cinematic gem.,4
Legends Unleashed,2012,58,0,Post-Graduate,female,Viewer,Employed,Action/Adventure,2009,127,Summer,4095,3.4,"It's not remarkable, but it's not terrible either.",10
Hilarity Unleashed,2020,29,2,Completed College,male,Viewer,Employed,Comedy,2019,121,Fall,7590,3.2,A film with its share of highs and lows.,9
The Adventurous Quest,2021,28,1,Completed College,female,Viewer,Unemployed,Action/Adventure,2011,108,Summer,9822,3.9,A cinematic experience that will resonate for ages.,8
Frozen in Time,2022,46,0,Post-Graduate,female,Critic,Employed,Drama,1984,141,Winter,2736,2,A regrettable watch that left me questioning my choices.,9
Visions of Valor,2013,58,0,Post-Graduate,male,Viewer,Employed,Action/Adventure,1987,120,Fall,2574,2.9,"I expected more, but it was just okay.",8
Eternal Love,2017,34,1,Post-Graduate,female,Viewer,Employed,Romance,2014,108,Fall,997,2.9,"A decent movie, but it didn't quite meet my expectations.",11
Beneath the Surface,2018,33,0,Post-Graduate,female,Viewer,Employed,Drama,2011,105,Fall,9202,3.7,A masterpiece of cinema.,4
The Enigmatic Drama,2015,66,0,Completed High School,male,Viewer,Employed,Drama,2018,118,Summer,5690,4,A cinematic masterpiece.,3
Midnight Whispers,2021,79,0,Completed High School,female,Critic,Retired,Drama,2012,115,Summer,9341,2.8,"Not a standout, but it's not entirely forgettable.",9
Silly Adventures,2022,46,0,Completed College,male,Viewer,Employed,Comedy,2018,127,Summer,607,2.9,A middle-of-the-road movie that didn't leave a strong impression.,13
Laughing Waters,2014,19,0,Post-Graduate,female,Viewer,Student,Comedy,2006,126,Spring,768,3.7,A treasure trove of beauty and inspiration.,7
Guardians of the Ancients,2012,42,3,Post-Graduate,male,Viewer,Employed,Action/Adventure,2014,116,Summer,3224,3.4,A middle-of-the-road movie that didn't leave a strong impression.,13
Odyssey of Legends,2018,57,0,Post-Graduate,female,Viewer,Employed,Action/Adventure,2011,117,Fall,7179,3.4,A neutral narrative that left me feeling indifferent.,8
Laughing Waters,2011,20,0,Post-Graduate,female,Viewer,Student,Comedy,2006,126,Spring,768,3.7,An extraordinary achievement that left me in awe.,8
Love in the Air,2011,31,1,Completed High School,female,Viewer,Employed,Romance,2018,130,Summer,6969,4.1,A heartfelt triumph that resonates deeply.,6
Lost Treasures,2010,69,0,Completed High School,female,Critic,Student,Action/Adventure,2009,144,Spring,4040,2.5,An uninspired mess that left me wondering why I bothered.,10
Crazy Antics,2018,80,0,Post-Graduate,female,Viewer,Retired,Comedy,1992,131,Winter,6745,2.7,A film that left me bewildered and completely unfulfilled.,9
Whispers of Hope,2022,19,0,Completed College,female,Viewer,Student,Drama,2018,120,Summer,389,4.4,This movie is pure magic. It captures the essence of childhood dreams and takes you on an adventure.,18
The Last Crusade,2009,35,1,Completed High School,female,Viewer,Employed,Action/Adventure,2015,106,Winter,4492,3.1,"It didn't exceed my expectations, but it wasn't bad.",11
Stellar Explorers,2020,48,1,Post-Graduate,male,Viewer,Employed,Sci-Fi,2013,98,Fall,8106,2.9,A movie that failed to make a memorable impression.,9
In Search of Truth,2019,52,0,Completed High School,female,Critic,Employed,Other,2007,112,Summer,6040,2.1,A movie that failed to deliver on its promises. Avoid at all costs.,13
Odyssey of Hope,2011,44,0,Completed College,female,Viewer,Employed,Action/Adventure,2019,111,Summer,9797,3.7,A cinematic gem that shines brightly in the industry.,9
Whispers of Hope,2016,31,0,Completed College,female,Viewer,Employed,Drama,2018,120,Summer,389,3.9,A total crowd-pleaser.,4
Broken Promises,2014,63,0,Completed High School,female,Viewer,Employed,Drama,2008,125,Fall,5560,3.7,A breathtaking masterpiece that speaks to the heart.,8
Shattered Illusions,2015,57,0,Completed College,female,Critic,Employed,Drama,2013,98,Fall,8485,1.9,Total letdown.,2
Epic Discovery,2020,46,0,Completed High School,female,Viewer,Employed,Action/Adventure,1994,130,Fall,7677,3.6,A phenomenal performance.,3
Epic Discovery,2015,49,0,Completed College,male,Viewer,Unemployed,Action/Adventure,1994,130,Fall,7677,3.5,A mesmerizing and emotionally resonant triumph.,6
Eternal Sunshine,2017,29,0,Post-Graduate,female,Viewer,Employed,Drama,2017,142,Summer,4603,4,Riveting from start to finish - a true gem.,8
Eerie Echoes,2016,45,0,Post-Graduate,female,Critic,Employed,Horror,2018,112,Fall,9634,2,An agonizing viewing experience that I wish I could forget.,10
Laughter Therapy,2011,56,0,Post-Graduate,male,Viewer,Employed,Comedy,1996,143,Summer,2829,2.6,A trainwreck of a film that I wish I hadn't seen.,12
Eternal Echoes,2017,21,0,Post-Graduate,female,Viewer,Employed,Drama,1992,136,Summer,7130,4.1,A heartfelt and beautifully crafted cinematic journey.,7
Frozen in Time,2022,47,0,Post-Graduate,male,Viewer,Employed,Drama,1984,141,Winter,2736,3.6,A remarkable achievement that touched my heart.,7
Beyond Boundaries,2017,22,0,Completed High School,male,Critic,Student,Other,2018,114,Fall,8184,2.8,It's hard to form a strong opinion about it.,10
Rise of the Phoenix,2015,69,0,Post-Graduate,male,Viewer,Employed,Action/Adventure,2006,126,Winter,6613,3.3,An adequate effort that didn't leave a lasting impact.,10
Joyful Journeys,2008,32,2,Completed College,female,Critic,Retired,Kids,2005,111,Spring,9030,3.1,"There are parts I liked, but overall, it's average.",10
Guardians of the Ancients,2022,29,1,Completed College,female,Viewer,Employed,Action/Adventure,2014,116,Summer,3224,3.6,An unforgettable experience! The deep emotional connections and the exploration of human nature in this movie were thought-provoking. I highly recommend it.,23
Heartstrings,2011,28,2,Completed College,male,Viewer,Employed,Romance,1991,123,Summer,5066,4.1,Couldn't stop smiling!,4
Shattered Reflections,2022,55,0,Completed High School,female,Critic,Employed,Drama,2017,125,Spring,2500,2.3,Predictable and utterly unimpressive.,4
Endless Love,2020,39,1,Completed High School,female,Viewer,Employed,Romance,2016,147,Spring,3185,3.7,"The performances were top-notch, leaving me in awe.",9
Whispers in the Dark,2010,33,1,Completed College,female,Critic,Employed,Horror,2020,130,Spring,2052,2.1,"I couldn't wait for this movie to be over. It was painful to watch, and I had no emotional investment in the characters.",24
Broken Promises,2008,18,2,Post-Graduate,female,Viewer,Employed,Drama,2008,125,Fall,5560,3.9,An extraordinary journey that left me inspired.,7
Rise of the Phoenix,2022,73,0,Post-Graduate,female,Critic,Retired,Action/Adventure,2006,126,Winter,6613,2,Regretful choice.,2
Stellar Explorers,2016,58,0,Post-Graduate,male,Viewer,Employed,Sci-Fi,2013,98,Fall,8106,2.7,Total letdown.,2
Cosmic Adventures,2022,52,1,Completed College,male,Viewer,Employed,Sci-Fi,2012,119,Fall,8655,3.8,A symphony of emotions that left me deeply touched.,9
Eternal Love,2020,36,0,Completed College,male,Viewer,Employed,Romance,2014,108,Fall,997,3,A film that didn't fully engage me but had its moments.,12
Amour Forever,2021,18,1,Completed High School,female,Viewer,Student,Romance,2004,134,Fall,6251,4.7,This movie is a triumph. It's an emotional rollercoaster that will leave you in awe of the human spirit.,20
Stellar Explorers,2016,35,1,Completed College,male,Viewer,Employed,Sci-Fi,2013,98,Fall,8106,3.1,A film that left me feeling indifferent.,7
Chronicles of Courage,2022,51,0,Completed College,female,Viewer,Employed,Action/Adventure,1995,132,Summer,1983,3.4,"It's neither here nor there, just an average movie.",10
Odyssey of Hope,2018,29,1,Completed High School,female,Critic,Employed,Action/Adventure,2019,111,Summer,9797,2.6,An uninspired and regrettable mess that left me unsatisfied.,9
Shattered Illusions,2016,22,0,Completed College,female,Viewer,Student,Drama,2013,98,Fall,8485,4,A testament to the power of cinema to touch hearts.,10
Reflections of Reality,2016,71,0,Completed High School,male,Viewer,Retired,Other,2019,132,Summer,2599,3.6,A cinematic masterpiece.,3
Enchanted Playtime,2020,18,1,Post-Graduate,female,Viewer,Employed,Kids,2004,131,Spring,1041,4.3,A true gem of cinema.,5
Beyond the Stars,2021,25,0,Completed College,female,Viewer,Student,Sci-Fi,1997,133,Summer,3305,4.2,Elegantly executed with a compelling narrative.,6
Whispers of Fate,2013,25,0,Post-Graduate,male,Viewer,Employed,Drama,2009,102,Fall,8887,3.5,A genuine masterpiece that left me in awe.,8
Fading Memories,2020,28,1,Post-Graduate,male,Viewer,Employed,Drama,2001,133,Winter,1885,3.6,An extraordinary journey that left me inspired.,7
Lost Horizon,2016,62,0,Completed College,male,Viewer,Employed,Drama,2018,111,Spring,2643,3.4,A film that had its moments but didn't fully resonate.,11
Fun Under the Sun,2008,18,0,Post-Graduate,female,Viewer,Employed,Comedy,2019,123,Summer,7699,3.1,A film that had its moments but didn't fully deliver.,11
Wonderland Adventures,2020,41,0,Completed High School,female,Viewer,Employed,Kids,2012,98,Spring,2160,2.6,A disaster from start to finish. Don't subject yourself to it.,12
Frozen in Time,2011,37,2,Post-Graduate,female,Viewer,Employed,Drama,1984,141,Winter,2736,3.6,A cinematic treasure that left me deeply moved.,8
Realm of Illusions,2019,71,0,Completed High School,male,Viewer,Unemployed,Drama,2005,112,Summer,1520,3.6,"I couldn't have asked for more. The chemistry between the leads is electric, and the story is enchanting.",19
Crazy Antics,2021,62,0,Completed High School,male,Viewer,Student,Comedy,1992,131,Winter,6745,4.1,An emotional tour de force that left me moved.,9
The Enigmatic Drama,2017,33,0,Post-Graduate,male,Viewer,Employed,Drama,2018,118,Summer,5690,4,I was blown away by the sheer brilliance of this film.,11
Stolen Memories,2021,64,0,Completed College,female,Viewer,Employed,Drama,2003,109,Summer,3004,3.5,A masterpiece of cinema.,4
Mystic Shadows,2020,24,0,Completed College,male,Viewer,Employed,Drama,2010,120,Summer,1455,3.9,A film to remember.,4
Amour Forever,2006,18,0,Completed High School,male,Viewer,Student,Romance,2004,134,Fall,6251,4.4,Couldn't stop smiling!,4
Magic of Childhood,2021,64,0,Post-Graduate,female,Critic,Employed,Kids,2014,126,Winter,1036,1.7,A complete letdown that I wouldn't wish upon anyone.,10
Quest for Imagination,2005,47,1,Post-Graduate,female,Viewer,Employed,Kids,2005,122,Summer,3131,4.3,An instant favorite that I'll treasure forever.,8
Echoes of Eternity,2007,18,0,Completed College,female,Viewer,Student,Drama,1998,126,Summer,7245,4.8,Unforgettable movie moments.,3
In Search of Truth,2020,55,1,Post-Graduate,female,Critic,Employed,Other,2007,112,Summer,6040,2.1,A cinematic disaster that I wish I hadn't endured.,10
Heartstrings,2019,35,1,Post-Graduate,male,Viewer,Employed,Romance,1991,123,Summer,5066,3.6,Every scene was perfect.,4
Amour Forever,2022,37,0,Completed College,male,Critic,Employed,Romance,2004,134,Fall,6251,2.2,Waste of time.,3
Whispers in the Dark,2009,70,0,Post-Graduate,female,Viewer,Employed,Horror,2020,130,Spring,2052,3,A film that left me feeling indifferent.,7
Joyful Journeys,2002,36,3,Completed College,female,Viewer,Employed,Kids,2005,111,Spring,9030,4.3,A breathtaking masterpiece that speaks to the heart.,8
Soulbound,2016,39,0,Completed High School,female,Viewer,Employed,Drama,2010,131,Fall,1618,3.7,A tapestry of emotions that touched my heart.,8
Requiem for a Dream,2015,33,2,Post-Graduate,male,Critic,Employed,Drama,2008,128,Winter,3517,2.5,"A complete trainwreck of a film. The pacing was off, and the ending was unsatisfying.",15
Enchanted Playtime,2014,52,2,Completed College,female,Critic,Employed,Kids,2004,131,Spring,1041,3,A neutral outing that didn't fully resonate.,8
Edge of Eternity,2016,55,0,Post-Graduate,female,Viewer,Employed,Drama,2018,104,Winter,4137,3.2,A film that neither impressed nor disappointed me.,8
Eternal Sunshine,2021,59,2,Post-Graduate,female,Viewer,Employed,Drama,2017,142,Summer,4603,4.3,An enchanting story that will warm your soul.,8
Chronicles of Destiny,2016,45,0,Post-Graduate,female,Viewer,Employed,Action/Adventure,2000,125,Fall,4695,3.2,"I wouldn't call it memorable, just another film.",9
A Glimpse Through Time,2017,36,1,Post-Graduate,female,Viewer,Employed,Other,1989,111,Fall,8842,3.3,"Some scenes were interesting, others were forgettable.",7
Forgotten Realms,2008,18,0,Completed College,male,Viewer,Student,Drama,2013,129,Summer,3337,4.6,Every frame felt like a work of art. A must-see.,11
Silly Adventures,2017,65,0,Post-Graduate,female,Viewer,Employed,Comedy,2018,127,Summer,607,2.6,"I expected more, but this movie left me thoroughly unsatisfied.",10
Frozen in Time,2018,65,0,Completed College,male,Viewer,Employed,Drama,1984,141,Winter,2736,3.5,Loved every minute of it.,5
Under the Rainbow,2022,58,0,Completed High School,female,Viewer,Employed,Kids,1996,122,Summer,530,3.3,A mixed bag of emotions and storytelling.,7
Rising Stars,2007,36,0,Post-Graduate,female,Viewer,Employed,Drama,2000,112,Summer,2889,3.4,A film that didn't fully engage me but had its moments.,12
Unseen Horizons,2019,63,2,Completed College,female,Viewer,Retired,Drama,2010,127,Summer,7985,4.4,Absolutely stunning film.,3
Shattered Reflections,2018,67,0,Completed High School,male,Viewer,Employed,Drama,2017,125,Spring,2500,3.6,A heartfelt triumph that resonates deeply.,6
